id_article,title,tags,content,url,category,source,author,image,published_date,content_hash
32ede57693c4,Trump White House orders more federal layoffs amid shutdown,"donald trump news, federal workers, government shutdown, russell vought, politics","As the federal government shutdown heads into its second weekend, the Trump administration has begun what it calls “substantial” layoffs of federal workers. President Trump and his team had suggested this would be coming, but it was Office of Management and Budget Director Russell Vought who made it official. Congressional correspondent Lisa Desjardins reports on the agencies affected. Geoff Bennett: As the federal government shutdown heads into its second weekend, the Trump administration has started what it says are substantial layoffs of federal workers. The president and his team had suggested this would be coming, but it was Office of Management and Budget Director Russell Vought who made it official on social media this afternoon, stating simply: ""The RIFs have begun."" For more on what agencies might be affected by this reduction in force, we turn to our congressional correspondent, Lisa Desjardins. Lisa, you have been working the phones all afternoon. Lisa Desjardins: Yes. Geoff Bennett: What have you learned? Lisa Desjardins: Our whole team has. Well, President Trump actually just spoke to reporters a few minutes ago. And he said the layoffs, there will be a lot of them, but that numbers will still be coming. We don't have the numbers yet. So there is a real question here about how widespread these substantial RIFs, or layoffs, are, as we have been told by the Office of Management and Budget. Are they really large, or is it that the administration wants them to be perceived that way, so that they can leverage and pressure Democrats, among others? One thing we do know a little bit about is where they are happening. From our calls and sourcing today, we can report that these eight agencies will be seeing these mass layoffs. This includes some large agencies like Department of Homeland Security, the Treasury and Education. Many of these did experience large staffing cuts, either from the DOGE retirement plan or from previous layoffs. Now, again, we don't know how large they are. The IRS has confirmed to me that there are in fact mass layoffs happening there, again, don't know how large. There is a union that has said they think perhaps 1,300 People may have been laid off at Treasury, but we need to see the notices. And one reason that's important is, when do these take effect? Thirty days, by law, is the minimum notice that must be given for these reductions in force. Geoff Bennett: And, as we said, there's a lot we don't know. But are there specific examples of agencies or programs that have been targeted for these cuts? Lisa Desjardins: We do know of one where we can get specific. This is a subagency of the Department of Homeland Security. It's known as CISA. That stands for the Cybersecurity and Infrastructure Security Agency. They watch basically the digital world, the Internet, protect Americans from threats from that area. Now, I know, I have reported — well, first of all, the agency is about 2,500 people, for perspective; 127 of them are going to be laid off or have been laid off. So that's about 5 percent of the agency. But here's the thing. They are all within one subdivision, a subdivision that specializes in dealing with corporations and social media, the same subdivision that Republicans say took down political speech, and it is the one that was blocking disinformation dealing with Facebook. So that's a targeted agency that Republicans don't like; 70 percent of that group is being cut here. I bring this up because President Trump also just told reporters that, again, this will be Democratic-oriented cuts. So we have to watch. What does this mean agency to agency? How much of it is about policy? Geoff Bennett: Lisa Desjardins, our thanks to you, as always. Lisa Desjardins: You're welcome.",https://www.pbs.org/newshour/show/trump-white-house-orders-more-federal-layoffs-amid-shutdown,Politics,BBC,,https://d3i6fh83elv35t.cloudfront.net/static/2025/10/federallayoffs-1024x683.jpg,2025-10-10T18:45:32-04:00,c96b76beb5baaa640b3a42f09963b22f6dbcd636
8062b58dd383,WATCH: Kilmar Abrego Garcia’s attorneys discuss ICE’s continued efforts to deport him to Africa,"africa, deportations, eswatini, ghana, immigration, immigration and customs enforcement, kilmar abrego garcia, politics","GREENBELT, Md. (AP) — The Trump administration is pushing again to deport Kilmar Abrego Garcia, a Maryland man who was mistakenly sent to El Salvador, and hasn’t given up on moving him to Eswatini or Ghana even though both have rejected the idea, an immigration official told a judge Friday. Abrego Garcia has challenged efforts to re-deport him to a third country after the government admitted that a previous order prevents his deportation to his home country of El Salvador. U.S. Immigration and Customs Enforcement said recently that it plans to deport him to the southern African country of Eswatini. WATCH: Kilmar Abrego Garcia’s attorney discusses his case amid new deportation effort The case has come to represent the bitter partisan struggle over the President Donald Trump’s sweeping immigration policy and mass deportation agenda. U.S. District Judge Paula Xinis in Maryland will decide whether Abrego Garcia should remain in custody or be released from immigration detention while his challenge moves forward. She ordered government officials to explain the steps they have taken to remove Abrego Garcia to another country. An ICE official told the judge during a hearing Friday that the government was continuing to talk with officials in Eswatini about sending him there even though the country rejected the idea this week. He said his understanding is that the administration also was still in discussions with Ghana. However, Ghana’s foreign minister, Sam Okudzeto Ablakwa, posted on social media Friday that the nation will not accept Abrego Garcia. Abrego Garcia could be removed within 72 hours if the judge allows it and once the administration receives approval from a third country, said John Schultz, a deputy assistant director who helps oversee removals for ICE. “We could quickly operationalize the removal,” Schultz said. Abrego Garcia’s attorneys have charged that the Republican administration is trying to illegally use the immigration system to punish him after the embarrassment of his mistaken deportation. Meanwhile, attorneys in criminal court in Tennessee have made similar claims about retribution in the human smuggling charges brought against Abrego Garcia in June on the day he was returned to the U.S. from El Salvador. The Tennessee judge has concluded that Abrego Garcia’s prosecution may be an illegal retaliation after he successfully sued the Trump administration over his deportation. The smuggling charges stem from a 2022 traffic stop in Tennessee. Abrego Garcia was not charged at the time, and agents did not begin investigating the stop until earlier this year after his wife sued over his deportation. At a Friday hearing in Nashville, U.S. District Judge Waverly Crenshaw said he will hear evidence on the motion to dismiss the charges on Nov. 3. In addition, defense attorneys said they intend to file a motion asking that statements unrelated to the smuggling charges be removed from the indictment. Attorney Jenna Dabbs cited allegations that her client is a member of the MS-13 gang as an example of the extraneous accusations that are not relevant to the actual charges. Trump administration officials have waged a relentless public relations campaign against Abrego Garcia, repeatedly referring to him as a member of MS-13, among other things, despite the fact he has not been convicted of any crimes. Loller reported from Nashville, Tenn. A free press is a cornerstone of a healthy democracy. Support trusted journalism and civil dialogue. Donate now",https://www.pbs.org/newshour/politics/watch-kilmar-abrego-garcias-attorneys-discuss-ices-continued-efforts-to-deport-him-to-africa,Politics,BBC,,https://d3i6fh83elv35t.cloudfront.net/static/2025/10/2025-08-25T110143Z_1550157001_RC2BEGAGETB7_RTRMADP_3_USA-TRUMP-MIGRATION-ABREGO-GARCIA-1024x683.jpg,2025-10-10T18:42:25-04:00,0aaa637d9e955df8584fa9a2ce13fbda1640f34f
0b68692ef442,"Trump showing ‘no interest’ in negotiating to end shutdown, Jeffries says","donald trump news, government shutdown, hakeem jeffries, politics","Geoff Bennett: Well, keeping our focus on the shutdown, yesterday, we heard from Republican Senate Majority Leader John Thune. And, today, for a Democratic view, I spoke earlier with House Democratic Leader Hakeem Jeffries. Leader Jeffries, welcome back to the ""News Hour."" Rep. Hakeem Jeffries (D-NY): Thanks for having me on. Geoff Bennett: When you were on this program nine days ago, you said there'd been no communication from either the White House or Republican leaders in the House or the Senate about ending this shutdown. It doesn't appear that that's changed. Has it? Rep. Hakeem Jeffries: It has not changed, unfortunately. This is day 10 of the Trump-Republican shutdown. Clearly, they don't want to reopen the government. As Democrats, we have made clear we will sit down with anyone, any time, any place to have a bipartisan negotiation about enacting a spending bill that makes life better for the American people, reopens the government, and addresses the Republican health care crisis. Unfortunately, House Republicans, who canceled votes last week, canceled votes this week, and have now canceled votes next week, remain on vacation, missing in action. And Donald Trump has shown no interest in actually trying to resolve this situation. Geoff Bennett: What do you make of these Republican proposals to partially reopen the government, funding select agencies, while leaving other ones shuttered? Rep. Hakeem Jeffries: I think it's important for us to make sure that we actually pay our men and women in uniform in a manner consistent with what has been done in prior shutdowns. That should be priority number on, at this moment, more than 1.3 million people who are on active-duty and have been asked to work without pay because of the Republican refusal to address this issue. And so I think we need to take that step forward and then evaluate whatever other proposals come forward relative to reopening the government. But we have to reopen the government in a way that also addresses the Republican health care crisis and the Republicans' continued refusal to extend the Affordable Care Act tax credits, which is going to have a devastating impact on premiums, co-pays, and deductibles for tens of millions of Americans all across the country. Geoff Bennett: As we speak this afternoon, the OMB director, Russ Vought, tweeted moments ago, ""The RIFs have begun,"" making good apparently on the threat of mass layoffs by the Trump administration. An OMB spokesperson says that the layoffs will be significant. Do you have a sense of which agencies would be affected, how many people would be affected? And, beyond that, this is a clear power play by the administration to force the hand of Democrats. Does this play any role in your decision-making? Rep. Hakeem Jeffries: Donald Trump and his corrupt administration have been engaging in mass firings and layoffs of federal employees since January 20. They have been targeting hardworking federal employees, pressuring them, dismissing them without justification and violating the law. So this is just a continuation of the chaos, the crisis, and the confusion that we have seen during the entirety of the Trump administration. We're going to continue to stay the course as Democrats. That's what House and Senate Democrats have done together to address this the situation that Republicans have created, largest cut to Medicaid in American history, hospitals, nursing homes, and community-based health clinics closing all throughout America, particularly in rural parts of this country. The fact that Republicans refuse to extend the Affordable Care Act tax credits, resulting in dramatically increased health care premiums for tens of millions of Americans that will cost double, triple, or quadruple what they are currently paying. Some will face medical bankruptcy. Many others will be unable to get the insurance and the access to the doctors that they need. And on top of all of that, they're targeting the National Institutes of Health, the Centers for Disease Control in ways that are going to undermine the public health infrastructure in the United States of America. This has been an all-out Republican assault on the health care of the American people, which is why it needs to be decisively addressed right now, because it impacts everyone. Geoff Bennett: When you talk about Democrats and Republicans working together on health care, Congresswoman Marjorie Taylor Greene, who, as you well know, no fan of Democrats, not typically aligned with Democrats, says she supports preserving the ACA subsidies, in large part because she says the insurance premiums of her adult children are set to skyrocket. Does that signal any real opening for bipartisan cooperation? Rep. Hakeem Jeffries: I think what it signals is a growing recognition amongst my Republican colleagues that we have a health care crisis. Unfortunately, it's the health care crisis that they have created. And it needs to be decisively addressed. House Republican leaders continue to bury their heads in the sand, unfortunately, and they're joined by Senate Republican leadership that continues to force vote after vote on their partisan Republican spending bill that Democrats aren't supporting because that partisan Republican spending bill continues to gut the health care of everyday Americans. And that's not an acceptable situation in this country, the wealthiest country in the history of the world. Geoff Bennett: I want to ask you about the politics of all this, because, just the other day, Senate Minority Leader Chuck Schumer, he said that Democrats have the momentum and he said — quote — ""Every day gets better for us."" Republicans are seizing upon that, including the Senate majority leader, John Thune, who was on this program last night, and they are accusing Democrats of politicizing the shutdown. Do you worry that a moment like that, a statement like that undercuts what you see as Democrats having the moral high ground? Rep. Hakeem Jeffries: Well, House Democrats and Senate Democrats led by Leader Schumer are in this fight to make life better for the American people, to lower health care costs, to address the Republican health care crisis, to cancel the cuts, and to save the health care of the American people. That's the reason why we're in this fight. Geoff Bennett: For federal workers who risk missing a paycheck, for military families facing uncertainty, for everyday Americans who want to visit a national park, they are all wondering, when will this shutdown end? What would you tell them? Rep. Hakeem Jeffries: We need Donald Trump and Republicans to come to the negotiating table. We want to reopen the government. We want to reopen it now. We want to reach a bipartisan agreement in a way that spends taxpayer dollars that actually improve the quality of life of the American people, that addresses the cost of living crisis that we're confronting in this country. Donald Trump and Republicans promised that costs would go down on day one. But costs aren't going down under Republican control of government here in Washington. Costs are going up. Inflation is going up. The Trump tariffs are making life more expensive for millions of Americans who are paying thousands of dollars in additional expense per year. And now we're on the brink of this massive increase in premiums, co-pays, and deductibles because of Republican refusal to sit down and negotiate an extension around the Affordable Care Act tax credits. We stand by our hardworking federal employees. We will continue to support them. We stand by the American people, and we want to bring this to a close, but we need good faith partners on the other side of the aisle to sit down and negotiate a bipartisan path forward. Geoff Bennett: House Democratic Leader Hakeem Jeffries, thanks again for your time. We appreciate it. Rep. Hakeem Jeffries: Thank you.",https://www.pbs.org/newshour/show/trump-showing-no-interest-in-negotiating-to-end-shutdown-jeffries-says,Politics,BBC,,https://d3i6fh83elv35t.cloudfront.net/static/2025/10/shutdown-3-1024x683.jpg,2025-10-10T18:40:06-04:00,2896766906d292c8950a8987bc940cceb6b5b7e0
c5049f71e260,Unlikely alliance builds cleaner geothermal energy network in Massachusetts community,"basic research, geothermal energy, massachusetts, science, tipping point, science","Geoff Bennett: Now the story of an unlikely partnership between a utility company and climate activists and how they worked together to help one community switch its heating and cooling to a cleaner source. Science correspondent Miles O'Brien has the story, part of our Tipping Point coverage on energy and climate. Miles O’Brien: Retired schoolteacher Carol Canova has lived in this tiny little house in Framingham, Massachusetts for 30 years. From this humble perch, she has experienced firsthand a historic energy transition. She started with an oil-burning furnace, then switched to gas, and now heats and cools with an electric heat pump attached to a geothermal well. Carol Canova, Framingham, Massachusetts, Resident: I was told it would be even heat. I was told it would be efficient and so forth. But seeing is believing. I'd never been in a house that every place in the house was the same temperature. Miles O’Brien: Canova is part of a first-in-the-nation pilot by utility giant Eversource. It's a one-mile network of underground pipes connecting three dozen homes and municipal buildings to a shared geothermal well. It's called networked geothermal, and if it works here, it could be a blueprint for utilities nationwide. Carol Canova: So I thought, oh, electricity is expensive. So I'm expecting it's going to be more expensive. What I find out is, it's overall cheaper. Miles O’Brien: Heat pumps live up to their name. They move heat. In the summer, they pump heat out of your home. In the winter, they bring it in. How hard they have to work and how much electricity they use depends on the temperature difference between inside and outside. The greater the gap, the more energy they need. Shallow geothermal wells tap into the earth's steady underground temperature, about 55 degrees year-round. Water with antifreeze circulates through buried pipes, absorbing or releasing heat at that consistent temperature. A heat pump paired with a geothermal well has less work to do and is far more efficient no matter the weather above. The catch? Drilling a geothermal well is very expensive, but none of the volunteers in this project paid a dime for either the well or the heat pump. Carol Canova: When Eversource offered it, I thought, you know what, this is like winning the lottery. Nikki Bruno, Vice President, Eversource: Everything else is buried in underground, except for the heat pumps. Miles O’Brien: Nikki Bruno is an Eversource V.P. Nikki Bruno: So, right outside this building is what we call the main bore field. Miles O’Brien: She showed me the pump house, which controls the entire system. It's the only visible sign of the geothermal network. Nikki Bruno: Those bores are 600 to 700 pipes that allow the water-based fluid to circulate and exchange energy with the underground. Miles O’Brien: Besides many homes like Carol's, heat pumps attached to the geothermal network are in use at a school administration building, a fire station, and a public housing development. It's an $18.6 million project that comes amid significant changes in regulations. Massachusetts and the other states in the Eversource territory have aggressive climate goals and mandates. Nikki Bruno: How do we start offering something different? How can we produce a decarbonized product for our customers, while keeping safe, reliable and I will say as affordable as possible service to customers? Miles O’Brien: The idea was born of an unlikely partnership between utility executives and climate activists, among them, Zeybeb Magavi, the executive director of the nonprofit HEET, the Home Energy Efficiency Team. It's a grassroots group that started out by banding together to insulate their homes. They were looking for a way to make a bigger dent. Zeybeb Magavi, Executive Director, HEET: We really became aware of kind of a rock-and-a-hard place problem, where we have a gas system that actually we have pipes in the ground from President Lincoln's time. Miles O’Brien: Their focus on creaky, leaky gas pipes led them to a moment of insight and inspiration. Zeybeb Magavi: The ground, the bedrock, the water all around us is thermal energy, which we can tap. And that's kind of an exciting awakening thing to realize. We could potentially build a utility street by street that was pipes filled with water, maintained and managed by the gas utility, who — becomes a thermal utility. This infrastructure would be in a way like the roots of our new energy system, right? Miles O’Brien: Even federal researchers are bullish. A study by the Oak Ridge National Laboratory found that mass adoption of geothermal heat pumps could reduce the demand for electricity by 13 percent in the next 25 years. But the idea isn't new. Let's go down in the boiler room. Here we go. You got people down here shoveling coal, right? Jeff Tester, Engineering Professor, Cornell University: This is our living laboratory. Miles O’Brien: Cornell University engineering professor Jeff Tester built his home in Ithaca, New York, as a living lab of efficiency, solar thermal, photovoltaics, and a heat pump that taps into a geothermal well buried in his backyard. He's been advocating for ways to tap the heat beneath our feet since the 1970s, when he helped pioneer a novel geothermal energy concept at the Los Alamos National Laboratory. Jeff Tester: One method of extracting heat or mining heat from under the surface of the earth is to create a reservoir. Miles O’Brien: He looks back on those days with nostalgia. Jeff Tester: They were very supportive of trying new things in those days. We weren't afraid to try something. Miles O’Brien: For about 25 years, Cornell has harnessed a natural thermal engine to keep its campus cool. A district-chilling system taps 39-degree water from the depths of Cayuga Lake to cool more than 100 buildings. Now the university is looking to go deeper and warmer. Jeff Tester is the principal investigator on a groundbreaking project to introduce geothermal heating to the campus. In 2022, his team drilled a nearly two-mile-deep test borehole to assess the available heat resources here. Jeff Tester: I feel like I have been training all my life for the day when we actually would see this happen on a campus like Cornell. Miles O’Brien: But he's still waiting, looking for money to build a geothermal network of pipes filled with hot water to heat the campus. He says society places great value on fossil fuels and electricity. Jeff Tester: But heat is not viewed that way in the same way, and I think we need a fairer system of what I refer to as an equivalent way to actually look at the benefits from clean heating versus clean electricity versus clean fuels. And we're not doing that right now. So we need a new value system for energy. Miles O’Brien: The Trump administration apparently does value geothermal. Energy Secretary Chris Wright consistently emphasizes it as a priority, making it the only renewable energy source currently in favor. Zeybeb Magavi: It's something we can agree on. It's the ground beneath our feet. Turns out we have common ground. Miles O’Brien: And it appears to be growing. Plans are now in place to double the size of the Framingham geothermal network starting next year. Common ground may be hard to find these days, but perhaps it's not far beneath the surface. For the ""PBS News Hour,"" I'm Miles O'Brien in Framingham, Massachusetts.",https://www.pbs.org/newshour/show/unlikely-alliance-builds-cleaner-geothermal-energy-network-in-massachusetts-community,Politics,BBC,,https://d3i6fh83elv35t.cloudfront.net/static/2025/10/tappingtheunderground-1024x517.jpg,2025-10-10T18:35:47-04:00,274895b296591cfa4d19a8f7cd03a0469111a290
