id_article,title,tags,content,url,category,source,author,image,published_date,content_hash
b35e53f5b596,WATCH: Trump departs for Middle East as ceasefire agreement holds in Gaza,"donald trump news, egypt, israel, middle east, politics","WASHINGTON (AP) — President Donald Trump set off for Israel and Egypt on Sunday to celebrate the U.S.-brokered ceasefire and hostage deal between Israel and Hamas and urge Middle East allies to seize the opportunity to build a durable peace in the volatile region. It’s a fragile moment with Israel and Hamas only in the early stages of implementing the first phase of the Trump agreement designed to bring a permanent end to the war sparked by the Oct. 7, 2023, attack on Israel by Hamas-led militants. Trump thinks there is a narrow window to reshape the Mideast and reset long-fraught relations between Israel and its Arab neighbors. READ MORE: Trump achieved a breakthrough Gaza ceasefire, but a tough road lies ahead It is a moment, the Republican president says, that has been helped along by his administration’s support of Israel’s decimation of Iranian proxies, including Hamas in Gaza and Hezbollah in Lebanon. “Very excited about this moment in time,” Trump told reporters before Air Force One took off. He said many people in both Israel and Arab countries were “cheering” the agreement, adding that “everybody’s amazed and their thrilled and we’re going to have an amazing time.” The White House says momentum is also building because Arab and Muslim states are demonstrating a renewed focus on resolving the broader, decades-long Israeli-Palestinian conflict and, in some cases, deepening relations with the United States. Trump’s comments as the trip began followed him saying Friday that, “I think you are going to have tremendous success and Gaza is going to be rebuilt” and that “you have some very wealthy countries, as you know, over there. It would take a small fraction of their wealth to do that. And I think they want to do it.” A tenuous point in the agreement The first phase of the ceasefire agreement calls for the release of the final 48 hostages held by Hamas, including about 20 believed to be alive; the release of hundreds of Palestinian prisoners held by Israel; a surge of humanitarian aid to Gaza; and a partial pullback by Israeli forces from Gaza’s main cities. Israeli troops on Friday finished withdrawing from parts of Gaza, triggering a 72-hour countdown under the deal for Hamas to release the Israeli hostages, potentially while Trump is on the ground there. He said he expected their return to be completed on Monday or Tuesday. Trump said he will first visit Israel, where he has been invited to address Israel’s parliament, the Knesset, an honor last extended to President George W. Bush during a visit in 2008. Trump then will travel to Egypt, where he and Egyptian President Abdel-Fattah el-Sissi will lead a summit in Sharm el-Sheikh with leaders from more than 20 countries to discuss peace in Gaza and the broader Middle East. VIDEO It is a tenuous truce and it is unclear whether the sides have reached any agreement on Gaza’s postwar governance, the territory’s reconstruction and Israel’s demand that Hamas disarm. Negotiations over those issues could break down, and Israel has hinted it may resume military operations if its demands are not met. “I think the chances of (Hamas) disarming themselves, you know, are pretty close to zero,” H.R. McMaster, a national security adviser during Trump’s first term, said at an event hosted by the Foundation for the Defense of Democracies on Thursday. He said he thought what probably would happen in the coming months is that the Israeli military “is going to have to destroy them.” Israel continues to rule over millions of Palestinians without basic rights as settlements expand rapidly across the occupied West Bank. Despite growing international recognition, Palestinian statehood appears exceedingly remote because of Israel’s opposition and actions on the ground, The war has left Israel isolated internationally and facing allegations of genocide, which it denies. International arrest warrants against Israeli Prime Minister Benjamin Netanyahu and his former defense minister are in effect, and the United Nations’ highest court is considering allegations of genocide brought by South Africa. Hamas has been militarily decimated and has given up its only bargaining chip with Israel by releasing the hostages. But the Islamic militant group is still intact and could eventually rebuild if there’s an extended period of calm. Netanyahu reiterated that Israel would continue with its demilitarization of Hamas after the hostages are returned. “Hamas agreed to the deal only when it felt that the sword was on its neck — and it is still on its neck,” Netanyahu said Friday as Israel began to pull back its troops. Trump wants to expand the Abraham Accords Much of Gaza has been reduced to rubble and rebuilding is expected to take years. The territory’s roughly 2 million residents continue to struggle in desperate conditions. Under the deal, Israel agreed to reopen five border crossings, which will help ease the flow of food and other supplies into Gaza, parts of which are experiencing famine. Trump is also standing up a U.S.-led civil-military coordination center in Israel to help facilitate the flow of humanitarian aid as well as logistical and security assistance into Gaza. Roughly 200 U.S. troops will be sent to help support and monitor the ceasefire deal as part of a team that includes partner nations, nongovernmental organizations and private-sector players. The White House has signaled that Trump is looking to quickly return attention to building on a first-term effort known as the Abraham Accords, which forged diplomatic and commercial ties between Israel and the United Arab Emirates, Bahrain and Morocco. A permanent agreement in Gaza would help pave the path for Trump to begin talks with Saudi Arabia as well Indonesia, the most populous Muslim country, toward normalizing ties with Israel, according to a senior Trump administration official who briefed reporters on the condition of anonymity. Such a deal with Saudi Arabia, the most powerful and wealthy Arab state, has the potential to reshape the region and boost Israel’s standing in historic ways. But brokering such an agreement remains a heavy lift as the kingdom has said it won’t officially recognize Israel before a resolution to the Israeli-Palestinian conflict. Krauss reported from Ottawa, Ontario. A free press is a cornerstone of a healthy democracy. Support trusted journalism and civil dialogue. Donate now",https://www.pbs.org/newshour/politics/trump-prepares-for-middle-east-trip-to-highlight-ceasefire-agreement,Politics,BBC,,https://d3i6fh83elv35t.cloudfront.net/static/2025/10/2025-10-10T145155Z_633087330_RC229HAELED6_RTRMADP_3_USA-TRUMP-1024x683.jpg,2025-10-12T10:35:14-04:00,e1611dec9506386f3927bd1c45f309e2a7fde071
ab8c7113e5e4,"Appeals court rules U.S. troops Trump sent to Illinois can stay, but can’t be deployed for now","donald trump news, illinois, national guard, politics","CHICAGO (AP) — National Guard troops sent to Illinois by President Donald Trump can stay in the state and under federal control, but can’t be deployed to protect federal property or go on patrol for now, an appeals court ruled Saturday. READ MORE: What to know about Trump’s National Guard deployments in Chicago and Portland The decision comes after federal Judge April Perry on Thursday ruled to temporarily block the National Guard deployment for at least two weeks, finding no substantial evidence that a “danger of rebellion” is brewing in Illinois during Trump’s immigration crackdown. The appeals court on Saturday granted a pause in the case until it can hear further arguments. The on-again, off-again deployments stem from a political and legal battle over Trump’s push to send the Guard to several U.S. cities. His administration claims crime is rampant in those cities, despite statistics not always supporting that. If a president invokes the Insurrection Act, they can dispatch active duty military in states that fail to put down an insurrection or defy federal law. However, Perry said she found no substantial evidence that a “danger of rebellion” is brewing in Illinois during Trump’s immigration crackdown. She followed up Friday with an opinion that cites a mix of law and history, including the Federalist Papers, which were written in 1787-88 to support ratification of the U.S. Constitution. “There has been no showing that the civil power has failed,” Perry said. “The agitators who have violated the law by attacking federal authorities have been arrested. The courts are open, and the marshals are ready to see that any sentences of imprisonment are carried out. Resort to the military to execute the laws is not called for.” The judge said there was significant evidence that federal agents have been able to carry out their work, noting “huge increases in arrests and deportations.” The 500 Guard members from Texas and Illinois were mostly based at a U.S. Army Reserve Center in Elwood, southwest of Chicago. A small number were sent to a U.S. Immigration and Customs Enforcement building in Broadview. A free press is a cornerstone of a healthy democracy. Support trusted journalism and civil dialogue. Donate now",https://www.pbs.org/newshour/politics/appeals-court-rules-u-s-troops-trump-sent-to-illinois-can-stay-but-cant-be-deployed-for-now,Politics,BBC,,https://d3i6fh83elv35t.cloudfront.net/static/2025/10/2025-10-07T211601Z_646127881_RC277HAVHOS9_RTRMADP_3_USA-TRUMP-CHICAGO-1024x682.jpg,2025-10-11T18:45:34-04:00,c9770ae9923d3b5bb733a3c062acf93d21773411
56295c41080b,News Wrap: Trump orders Pentagon to use ‘all available funds’ to pay troops amid shutdown,"news wrap, politics","In our news wrap Saturday, Trump directed the Defense Department to ensure U.S. troops are paid on time as the government shutdown continues, authorities said there are no survivors from Friday’s blast that leveled a Tennessee explosives plant, and actor and producer Diane Keaton died at age 79. John Yang: Good evening. I'm John Yang. It's day 11 of the government shutdown and there are still no signs of efforts to end the congressional stalemate that's blocking federal funding. President Trump says he's directed the Defense Department to use all available funds to make sure U.S. troops are paid on time on Wednesday. Tomorrow, the Smithsonian museums and the National Zoo will close as they run out of the unspent prior year funds they've been using to keep the doors open. The president's trying to increase pressure on Democrats, saying he'll pick and choose which furloughed workers get back pay and slash programs Democrats care about. The administration is also moving ahead with plans for mass firings. On Friday, federal workers began receiving notices telling them that they'll be laid off in 60 days. The administration says that more than 4,100 workers will be fired across seven agencies, the moves being challenged in court. Authorities say there are no survivors from a blast that leveled an explosives plant in Tennessee, Friday. They say it's not clear yet how many people died, though earlier they said 18 people were missing. Actress and producer Diane Keaton has died. PBS News has confirmed. Over her long career, she won acclaim for roles in films as varied as ""The Godfather"" and ""Annie Hall,"" for which she won an Academy award. Keaton was 79 years old.",https://www.pbs.org/newshour/show/news-wrap-trump-orders-pentagon-to-use-all-available-funds-to-pay-troops-amid-shutdown,Politics,BBC,,https://d3i6fh83elv35t.cloudfront.net/static/2025/10/newswrap-14-1024x683.jpg,2025-10-11T17:50:56-04:00,fc991b88966384ff63de057050aafad2fa5ae880
5aebbb062491,Trump directs Pentagon to use ‘all available funds’ to pay troops despite shutdown,"donald trump news, government shutdown, military pay, u.s. military, politics","WASHINGTON (AP) — President Donald Trump said Saturday that he has directed the Defense Department to use “all available funds” to ensure U.S. troops are paid Wednesday despite the government shutdown, a short-term fix that will not apply to the hundreds of thousands of federal workers who have been furloughed. Trump said in a social media post that he was acting because “our Brave Troops will miss the paychecks they are rightfully due on October 15th.” The Republican president’s directive removes one of the pressure points that could have forced Congress into action, likely ensuring that the shutdown — now in its 11th day and counting — extends into a third week and possibly beyond. But no similar action seems forthcoming for federal employees also working without pay while thousands are now being laid off during the lapse in government operations. The White House budget office started the layoffs on Friday. WATCH: Trump White House orders more federal layoffs amid shutdown Trump blamed Democrats and said he was exercising his authority as commander in chief to direct Defense Secretary Pete Hegseth “to use all available funds to get our Troops PAID on October 15th.” The Republican president added, “We have identified funds to do this, and Secretary Hegseth will use them to PAY OUR TROOPS.” U.S service members were in danger of not receiving their next paycheck on Wednesday after the government shut down on Oct. 1, the start of the federal budget cycle. The U.S. has about 1.3 million active-duty service members, and the prospect of troops going without pay has been a focal point when lawmakers on Capitol Hill have discussed the shutdown’s negative impact. Trump did not say where he’s getting the money. One possible source would be the billions of dollars that were pumped into the Defense Department under Trump’s big tax and spending cut bill that he signed into law in July. The Congressional Budget Office said such a move was possible. A spokesperson for the White House Office of Management and Budget said Pentagon research and development funds would be used to pay the salaries. Federal workers typically receive back pay after a shutdown ends, as now required by a law that Trump signed during his first term. He recently floated the idea of not making up the lost salaries. It was unclear if the president’s directive applies to the U.S. Coast Guard, which is a branch of the U.S. Armed Forces but is overseen by the Department of Homeland Security during peacetime. The nation’s third shutdown in 12 years has again raised anxiety levels among service members and their families as those in uniform are working without pay. While they would receive back pay once the impasse ends, many military families live paycheck to paycheck. During previous shutdowns, Congress passed legislation to ensure that troops kept earning their salaries, but discussion of taking a similar step by lawmakers appeared to have fizzled out. Asked earlier this week if he would support a bill to pay the troops, Trump said, “that probably will happen.” “We’ll take care of it,” he said Wednesday. “Our military is always going to be taken care of.” The shutdown began on Oct. 1 after Democrats rejected a short-term funding fix and demanded that the bill include an extension of federal subsidies for health insurance under the Affordable Care Act. The expiration of those subsidies at the end of the year will result in monthly cost increases for millions of people. Trump and Republican leaders have said they are open to negotiations on the health subsidies, but insist the government must reopen first. Both sides appear dug in on their positions, making it unclear when, or how, the shutdown ends. A free press is a cornerstone of a healthy democracy. Support trusted journalism and civil dialogue. Donate now",https://www.pbs.org/newshour/politics/trump-directs-pentagon-to-use-all-available-funds-to-pay-troops-despite-shutdown,Politics,BBC,,https://d3i6fh83elv35t.cloudfront.net/static/2025/10/2025-10-10T182023Z_1715195819_RC269HAL07UH_RTRMADP_3_USA-TRUMP-1024x760.jpg,2025-10-11T15:47:11-04:00,225d11f58f8e90f1815edae239190547277ced3e
5c25786ceaed,"Biden is receiving radiation and hormone therapy to treat his prostate cancer, aide says","cancer, joe biden, prostate cancer, politics","WASHINGTON (AP) — Former President Joe Biden is receiving radiation and hormone therapy as part of a new phase of treating the aggressive form of prostate cancer he was diagnosed with after leaving office, a spokesperson said Saturday. “As part of a treatment plan for prostate cancer, President Biden is currently undergoing radiation therapy and hormone treatment,” said Biden aide Kelly Scully. WATCH: After Biden’s diagnosis, a look at prostate cancer’s impact on men in the U.S. The 82-year-old Democrat left office in January after he had dropped his bid for reelection six months earlier following a disastrous debate against Republican Donald Trump amid concerns about Biden’s age, health and mental fitness. Trump defeated Democrat Kamala Harris, who was Biden’s vice president. In May, Biden’s postpresidential office announced that he had been diagnosed with prostate cancer and that it had spread to his bone. The discovery came after he reported urinary symptoms. Prostate cancers are graded for aggressiveness using what is known as a Gleason score. The scores range from 6 to 10, with 8, 9 and 10 prostate cancers behaving more aggressively. Biden’s office said his score was 9, suggesting his cancer is among the most aggressive. Last month, Biden had surgery to remove skin cancer lesions from his forehead. A free press is a cornerstone of a healthy democracy. Support trusted journalism and civil dialogue. Donate now",https://www.pbs.org/newshour/politics/biden-is-receiving-radiation-and-hormone-therapy-to-treat-his-prostate-cancer-aide-says,Politics,BBC,,https://d3i6fh83elv35t.cloudfront.net/static/2025/10/2025-05-30T175550Z_666714624_RC2GSEAXEWII_RTRMADP_3_USA-BIDEN-1024x683.jpg,2025-10-11T13:32:33-04:00,d2f657d75643f5e249445bdc774cab760bb4e4a7
1bab36ee4e74,"Candidates in Virginia governor’s debate clash over government shutdown, violent rhetoric","abigail spanberger, debates, elections, gubernatorial races, virginia, winsome earle-sears, politics","Spanberger, who largely avoided addressing her Republican opponent directly, set a more sterile and bipartisan tone. The personal clashes overshadowed the policy fights at times, which focused on violent rhetoric, the federal shutdown and transgender children. The economy was an afterthought. Here are some takeaways from the debate at Norfolk State University: A contrast in styles Perhaps even more than policy differences, the candidates’ personal styles shaped the debate. Earle-Sears, with her only chance to confront Spanberger before Election Day, was far more aggressive. She repeatedly turned toward Spanberger and interrupted her answers, despite being admonished by the moderators. The approach put the Democrat on the defensive after months of running the race largely on her own terms as the perceived frontrunner. Democratic gubernatorial candidate and former Rep. Abigail Spanberger, D-Va., addresses a small get-out-the-vote rally on the first day of early voting in Henrico, Virginia. Photo by Chip Somodevilla/ Getty Images Spanberger, while she criticized her opponent at times, faced forward throughout, avoided eye contact and only rarely addressed Earle-Sears directly. She did not speak during Earle-Sears’ answers, even when her opponent asked direct questions, resulting in moments of awkward silence. Earle-Sears told Spanberger she was a liar, said she “should have stayed in Congress” and questioned her courage. “Don’t lie like that, Abigail!” she shouted at one point. The interruptions lasted up until the very final moments, when the moderators cut off the microphones. A scandal at the outset A scandal shaped the very beginning of the debate, although it was not a scandal directly involving either candidate onstage. Instead, it was the Democratic nominee for attorney general, Jay Jones. He has been heavily criticized in recent days following last week’s publication of text messages from 2022 in which he suggested that Virginia’s former Republican House speaker get “two bullets in the head.” Earle-Sears, along with President Donald Trump, has demanded that Jones quit his race. Over and over again Thursday night, the Republican pushed Spanberger to do the same. “Abigail, what if he said it about your three children? Is that when you would say it’s time to get out of the race?” Earle-Sears asked. She later added, “She has no courage.” Facing repeated questions from the moderators and her opponent, the Democratic congresswoman declined to say whether Jones should leave the race, saying it’s up to voters to make their own decision. “I have denounced political violence, political rhetoric, no matter who is leading the charge,” Spanberger responded, pointing to violent rhetoric from Trump that Earle-Sears declined to denounce. “You routinely refer to me as your enemy. I’m not your enemy. You are not my enemy. We are political opponents,” Spanberger said. The shutdown The showdown over the shutdown flared Thursday night. Underway for more than a week, the federal shutdown is especially prevalent in Virginia, home to roughly 315,000 federal workers. Even before much of the federal government closed its doors last week, many Virginians were already affected by Trump’s spring push to slash federal jobs and his ongoing threats to impose more mass firings. Earle-Sears, a vocal Trump supporter, declined to criticize Trump or call on him to stop firing federal workers when asked directly by the moderators. Instead, she blamed Democrats for the mess and called on Spanberger to push Virginia Sens. Tim Kaine and Mark Warner, both Democrats, to vote in favor of a spending bill that would end the impasse with the Republican-controlled Congress. Spanberger responded, “I would encourage everyone, our Democratic senators, our Democratic House members, our Republican House members, to work and come back to the table.” Culture wars vs. wallets Many voters say they’re most concerned about the economy, but some of the most pointed moments of the debate were on cultural issues. In particular, Earle-Sears pressed Spanberger on whether she would keep transgender youths out of high school sports and bathrooms. The Republican lieutenant governor has flooded the airwaves with ads focused on the cultural divide that helped Trump win the presidency last fall, casting Spanberger as unwilling to protect Virginia’s children from sexual predators. “My answer is that each local community decision should be made between parents and educators and teachers in each community,” Spanberger said, pointing to her background in law enforcement and role as a mother. “Nothing is more important to me than the safety of all children,” she said. Spanberger declined to say whether she would rescind the measure signed by Republican Gov. Glenn Youngkin that would require students to go only to the restrooms of their birth gender. That did not satisfy Earle-Sears, who pressed Spanberger on what she would say if her own children were forced to undress in a bathroom with biological males. The Republican also implied that transgender students are a safety threat when asked. “We know that biological men are larger in strength than women,” she said. “This is biology.” Spanberger then sought to put Earle-Sears on the defensive, noting that the Republican opposes abortion rights and wants to outlaw gay marriage — something Earle-Sears didn’t object to. “My opponent has previously said that she doesn’t think that gay couples have the right to marry,” Spanberger said. “That’s not discrimination,” Earle-Sears interrupted. History in the making Two women stood on the debate stage as the Democratic and Republican nominees for the first time in state history, a reminder that Virginia is poised to elect its first female governor, no matter who wins on Nov. 4. Spanberger, 46, is a mother of three school-age children. She has represented a congressional district in northern Virginia since 2019. She is a former CIA case officer. In one of the few warm exchanges of the night, Earle-Sears pointed to Spanberger’s role as a mother when asked what qualities she likes about her opponent. “I believe she is a devoted mom. I truly believe that,” Earle-Sears said. “And I do believe that she cares.” Earle-Sears, a Marine veteran, may be better known statewide, having served as lieutenant governor for the last four years. A native of Jamaica, the 61-year-old mother of two, is the first Black woman elected to statewide office in Virginia. Spanberger complimented parts of her record. “I admire her faith,” Spanberger said, “and her service to this country.” Peoples reported from New York. Beaumont reported from Des Moines, Iowa. Olivia Diaz is a corps member for The Associated Press/Report for America Statehouse News Initiative. Report for America is a nonprofit national service program that places journalists in local newsrooms to report on undercovered issues. A free press is a cornerstone of a healthy democracy. Support trusted journalism and civil dialogue. Donate now",https://www.pbs.org/newshour/politics/candidates-in-virginia-governors-debate-clash-over-government-shutdown-violent-rhetoric,Politics,BBC,,https://d3i6fh83elv35t.cloudfront.net/static/2025/10/GettyImages-2233216313-1024x683.jpg,2025-10-10T19:30:34-04:00,85e2218d54819efa017b15e040a49acc2a424f1c
