id_article,title,tags,content,url,category,source,author,image,published_date,content_hash
3b1226e41fce,Trump says he may send Ukraine long-range Tomahawk missiles if Russia continues conflict,"donald trump news, long-range missiles, russia, tomahawk missiles, ukraine, politics","ABOARD AIR FORCE ONE (AP) — President Donald Trump on Sunday warned Russia that he may send Ukraine long-range Tomahawk missiles if Moscow doesn’t settle its war there soon — suggesting that he could be ready to increase the pressure on Vladimir Putin’s government using a key weapons system. “I might say, ’Look: if this war is not going to get settled, I’m going to send them Tomahawks,” Trump told reporters aboard Air Force One as he flew to Israel. “The Tomahawk is an incredible weapon, very offensive weapon. And honestly, Russia does not need that.” Trump said, “I might tell them that if the war is not settled — that we may very well.” He added, “We may not, but we may do it. I think it’s appropriate to bring up.” READ MORE: Russia targets Ukraine’s power grid as Moscow expresses ‘extreme concern’ over U.S. weapons His comments came after Trump spoke by phone earlier Sunday with Ukrainian President Volodymyr Zelenskyy, and Trump said he mentioned possibly sending Tomahawks during that conversation. “Do they want to have Tomahawks going in that direction? I don’t think so,” Trump said of Russia. “I think I might speak to Russia about that.” He added that “Tomahawks are a new step of aggression.” His suggestions followed Russia having attacked Ukraine’s power grid overnight, part of an ongoing campaign to cripple Ukrainian energy infrastructure before winter. Moscow also expressed “extreme concern” over the U.S. potentially providing Tomahawk cruise missiles to Ukraine. Putin himself has previously suggested that the United States supplying long-range missiles to Ukraine will seriously damage relations between Moscow and Washington. For his part, Zelenskyy described his latest call with Trump as “very productive,” and said the pair had discussed strengthening Ukraine’s “air defense, resilience, and long-range capabilities,” along with “details related to the energy sector.” VIDEO Trump in recent weeks has taken a notably tougher tact with Putin, after the Russian leader has declined to engage in direct talks with Zelenskyy about easing fighting. Last month, Trump announced that he now believes Ukraine could win back all the territory lost to Russia — a dramatic shift from the Republican’s repeated calls for Kyiv to make concessions to end Russia’s war in Ukraine. But the U.S. president, at least so far, has resisted Zelenskyy’s calls for Tomahawks. The weapon system would allow Ukraine to strike deeper into Russian territory and put the sort of pressure on Putin that Zelenskyy argues is needed to get the Russians to seriously engage in peace talks. Trump said aboard Air Force One of the war: “I really think Putin would look great if he got this settled” and that “It’s not going to be good for him” if not. ___ Weissert reported from Washington. Associated Press writer Aamer Madhani contributed to this report from Washington. A free press is a cornerstone of a healthy democracy. Support trusted journalism and civil dialogue. Donate now",https://www.pbs.org/newshour/politics/trump-says-he-may-send-ukraine-long-range-tomahawk-missiles-if-russia-continues-conflict,Politics,BBC,,https://d3i6fh83elv35t.cloudfront.net/static/2025/10/2025-10-12T205725Z_1392676908_RC2KAHA88PU3_RTRMADP_3_ISRAEL-PALESTINIANS-TRUMP-DEPARTURE-1024x683.jpg,2025-10-12T18:40:46-04:00,3dac1689a9f19c398d771d7479aac4d60a07e0dc
194e7dfc8e28,"On 12th day of shutdown, Vance warns new ‘painful’ cuts ahead","federal employees, federal workers, government shudown, j.d. vance, politics","Vice President JD Vance on Sunday said there will be deeper cuts to the federal workforce the longer the government shutdown goes on, adding to the uncertainty facing hundreds of thousands who are already furloughed without pay amid the stubborn stalemate in Congress. Vance warned that as the federal shutdown entered its 12th day, the new cuts would be “painful,” even as he said the Trump administration worked to ensure that the military is paid this week and some services would be preserved for low-income Americans, including food assistance. Still, hundreds of thousands of government workers have been furloughed in recent days and, in a court filing on Friday, the Office of Management and Budget said well over 4,000 federal employees would soon be fired in conjunction with the shutdown. The effects of the shutdown also grew Sunday with the Smithsonian announcing its museums, research centers and the National Zoo are temporarily closed going forward for lack of funding. “The longer this goes on, the deeper the cuts are going to be,” Vance said on Fox News’ “Sunday Morning Futures.” “To be clear, some of these cuts are going to be painful. This is not a situation that we relish. This is not something that we’re looking forward to, but the Democrats have dealt us a pretty difficult set of cards.” READ MORE: Trump directs Pentagon to use ‘all available funds’ to pay troops despite shutdown Labor unions have already filed a lawsuit to stop the aggressive move by President Donald Trump ’s budget office, which goes far beyond what usually happens in a government shutdown, further inflaming tensions between the Republicans who control Congress and the Democratic minority. The shutdown began on Oct. 1 after Democrats rejected a short-term funding fix and demanded that the bill include an extension of federal subsidies for health insurance under the Affordable Care Act. The expiration of those subsidies at the end of the year will result in monthly cost increases for millions. Trump and Republican leaders have said they are open to negotiations on the health subsidies, but insist the government must reopen first. For now, negotiations are virtually nonexistent. Dug in as ever, House leaders from both parties pointed fingers at each other in rival Sunday appearances on “Fox News Sunday.” “We have repeatedly made clear that we will sit down with anyone, anytime, anyplace,” said House Democratic leader Hakeem Jeffries of New York. “Republicans control the House, the Senate and the presidency. It’s unfortunate they’ve taken a my-way-or-the-highway approach.” House Speaker Mike Johnson blamed Democrats and said they “seem not to care” about the pain the shutdown is inflicting. “They’re trying their best to distract the American people from the simple fact that they’ve chosen a partisan fight so that they can prove to their Marxist rising base in the Democratic Party that they’re willing to fight Trump and Republicans,” he said. VIDEO Progressive activists, meanwhile, expressed new support for the Democratic Party’s position in the shutdown fight. Ezra Levin, co-founder of the leading progressive protest group Indivisible, said he is “feeling good about the strength of Dem position.” He pointed to fractures in the GOP, noting that Georgia Rep. Marjorie Taylor Greene publicly warned last week that health care insurance premiums would skyrocket for average Americans — including her own adult children — if nothing is done. “Trump and GOP are rightfully taking the blame for the shutdown and for looming premium increases,” Levin said. “Their chickens are coming home to roost.” And yet the Republican administration and its congressional allies are showing no signs of caving to Democratic demands or backing away from threats to use the opportunity to pursue deeper cuts to the federal workforce. Thousands of employees at the departments of Education, Treasury, Homeland Security and Health and Human Services, as well as the Environmental Protection Agency, are set to receive layoff notices, according to spokespeople for the agencies and union representatives for federal workers. “You hear a lot of Senate Democrats say, well, how can Donald Trump possibly lay off all of these federal workers?” Vance said. “Well, the Democrats have given us a choice between giving low-income women their food benefits and paying our troops on the one hand, and, on the other hand, paying federal bureaucrats.” Democrats say the firings are illegal and unnecessary. “They do not have to do this,” said Democratic Sen. Mark Kelly of Arizona on CNN’s “State of the Union.” “They do not have to punish people that shouldn’t find themselves in this position.” A free press is a cornerstone of a healthy democracy. Support trusted journalism and civil dialogue. Donate now",https://www.pbs.org/newshour/politics/on-12th-day-of-shutdown-vance-warns-new-painful-cuts-ahead,Politics,BBC,,https://d3i6fh83elv35t.cloudfront.net/static/2025/10/2025-08-28T190147Z_976354626_RC2IGGAIUME7_RTRMADP_3_USA-VANCE-WISCONSIN-1024x683.jpg,2025-10-12T17:50:32-04:00,3fb050faeb8c20edd8f89b5349989fd2043635d2
b2f2fae92c34,Russia targets Ukraine’s power grid as Moscow expresses ‘extreme concern’ over long-range U.S. weapons,"long-range missiles, power grid, power plant, russia, tomahawk cruise missiles, tomahawk missiles, ukraine, world","Russia attacked Ukraine’s power grid overnight, part of an ongoing campaign to cripple Ukrainian energy infrastructure before winter, and expressed “extreme concern” over the U.S. potentially providing Tomahawk cruise missiles to Ukraine. Kyiv regional Gov. Mykola Kalashnyk said two employees of Ukraine’s largest private energy company DTEK were wounded in Russian strikes on a substation. Ukraine’s Energy Ministry said that infrastructure was also targeted in the regions of Donetsk, Odesa and Chernihiv. “Russia continues its aerial terror against our cities and communities, intensifying strikes on our energy infrastructure,” Ukrainian President Volodymyr Zelenskyy wrote on X, noting that Russia had launched “more than 3,100 drones, 92 missiles, and around 1,360 glide bombs” over the past week. READ MORE: How Europe can defend itself against Russian drones and electronic warfare Zelenskyy called for tighter secondary sanctions on buyers of Russian oil. “Sanctions, tariffs, and joint actions against the buyers of Russian oil — those who finance this war — must all remain on the table,” he wrote, adding he had a “very productive” phone call with U.S. President Donald Trump, in which they discussed strengthening Ukraine’s “air defense, resilience, and long-range capabilities,” along with “details related to the energy sector.” Their discussion followed an earlier conversation on Saturday, Zelenskyy said, during which the leaders agreed on Sunday’s topics. In an interview with Fox News Channel’s “The Sunday Briefing” after his call with Trump, Zelenskyy was asked whether Trump had approved the Tomahawks. “We work on it,” he said. “And I’m waiting for president to yes. Of course we count on such decisions, but we will see. We will see.” Zelenskyy said Friday that he was in talks with U.S. officials about the possible provision of various long-range precision strike weapons, including Tomahawks and more ATACMS tactical ballistic missiles. Trump, who has been frustrated by Russia in his efforts to end the war, said last week that he has “sort of made a decision” on whether to send Tomahawks to Ukraine, without elaborating. A senior Ukrainian delegation is set to visit the U.S. this week. Kremlin spokesperson Dmitry Peskov said in remarks published Sunday that “the topic of Tomahawks is of extreme concern.” “Now is really a very dramatic moment in terms of the fact that tensions are escalating from all sides,” he told Russian state television reporter Pavel Zarubin. VIDEO Belarus President Alexander Lukashenko, a close ally of Russian President Vladimir Putin, also said in comments released Sunday that he doubts the U.S. will provide Ukraine with Tomahawk cruise missiles. “I think we need to calm down in this regard. Our friend Donald … sometimes he takes a more forceful approach, and then, his tactic is to let go a little and step back. Therefore, we shouldn’t take this literally, as if it’s going to fly tomorrow,” Lukashenko told Zarubin, who posted them on his Telegram channel on Sunday. Ukraine’s energy sector has been a key battleground since Russia launched its all-out invasion more than three years ago. The latest attacks on Ukraine’s energy grid came after Russian drone and missile strikes wounded at least 20 people in Kyiv, damaged residential buildings and caused blackouts across the country Friday, which Prime Minister Yuliia Svyrydenko described as “one of the largest concentrated strikes” against Ukraine’s energy infrastructure. Each year, Russia has tried to cripple the Ukrainian power grid before the bitter winter season, apparently hoping to erode public morale. Winter temperatures run from late October through March, with January and February the coldest months. Ukraine’s air force said Saturday that its air defenses intercepted or jammed 103 of 118 Russian drones launched against Ukraine overnight, while Russia’s Defense Ministry said it had shot down 32 Ukrainian drones over Russian territory. A free press is a cornerstone of a healthy democracy. Support trusted journalism and civil dialogue. Donate now",https://www.pbs.org/newshour/world/russia-targets-ukraines-power-grid-as-moscow-expresses-extreme-concern-over-long-range-u-s-weapons,Politics,BBC,,https://d3i6fh83elv35t.cloudfront.net/static/2025/10/2025-10-12T084013Z_1426931711_RC23AHA2UHFD_RTRMADP_3_UKRAINE-CRISIS-DONETSK-ATTACK-1-1024x678.jpg,2025-10-12T15:21:57-04:00,74c12aef5cb8b62a06e8ab139388aac3268f6f65
3f46d2ae00ae,China refuses to give in to Trump’s tariff threat,"china, donald trump news, tariffs, world","BEIJING (AP) — China signaled Sunday that it would not back down in the face of a 100% tariff threat from President Donald Trump, urging the U.S. to resolve differences through negotiations instead of threats. U.S. Vice President JD Vance defended Trump’s position and seemed to warn China not to be aggressive in its response. “China’s stance is consistent,” the Commerce Ministry said in a statement posted online. “We do not want a tariff war but we are not afraid of one.” It was China’s first official comment on Trump’s threat to jack up the tax on imports from China by Nov. 1 in response to new Chinese restrictions on the export of rare earths, which are vital to a wide range of consumer and military products. READ MORE: Wall Street tumbles in its worst day since April after Trump threatens more tariffs on China The back and forth threatens to derail a possible meeting between Trump and Chinese leader Xi Jinping and end a truce in a trade war in which new tariffs from both sides briefly topped 100% in April. In response, Vance said Sunday that Trump is committed to protecting America’s economic livelihoods while making the United States more self-sufficient. He said the fact that China has “so much control over critical supply in the United States of America” is the definition of a national emergency and therefore justifies Trump’s move to impose tough tariffs. “It’s going to be delicate dance and a lot of it is going to depend on how the Chinese respond. If they respond in a highly aggressive manner, I guarantee you the president of the United States has far more cards than the People’s Republic of China,” Vance said on Fox News Channel’s “Sunday Morning Futures.” “If, however, they’re willing to be reasonable, then Donald Trump is always willing to be a reasonable negotiator. We’re going to find out a lot in the weeks to come about whether China wants to start a trade war with us or whether they actually want to be reasonable,” Vance continued. “I hope they choose the path of reason. The president of the United States is going to defend America regardless.” Trump has raised taxes on imports from many U.S. trading partners since taking office in January, seeking to win concessions. China has been one of the few countries that hasn’t backed down, relying on its economic clout. “Frequently resorting to the threat of high tariffs is not the correct way to get along with China,” the Commerce Ministry said in its post, which was presented as a series of answers from an unnamed spokesperson to four questions from unspecified media outlets. The statement called for addressing any concerns through dialogue. “If the U.S. side obstinately insists on its practice, China will be sure to resolutely take corresponding measures to safeguard its legitimate rights and interests,” the post said. VIDEO In addition to the 100% tariff, Trump threatened to impose export controls on what he called “critical software,” without specifying what that means. Both sides accuse the other of violating the spirit of the truce by imposing new restrictions on trade. Trump said in a social media post that China is “becoming very hostile” and that it is holding the world captive by restricting access to rare earth metals and magnets. The Chinese Commerce Ministry post said the U.S. has introduced several new restrictions in recent weeks, including expanding the number of Chinese companies subject to U.S. export controls. On rare earths, the ministry said that export licenses would be granted for legitimate civilian uses, noting that the minerals also have military applications. The new regulations include a requirement that foreign companies get Chinese government approval to export items that contain rare earths sourced from China, no matter where the products are manufactured. China accounts for nearly 70% of the world’s rare earths mining and controls roughly 90% of their global processing. Access to the material is a key point of contention in trade talks between Washington and Beijing. The critical minerals go into many products, from jet engines, radar systems and electric vehicles to consumer electronics including laptops and phones. China’s export controls have hit European and other manufacturers, as well as American ones. The Commerce Ministry statement said that the U.S. is also ignoring Chinese concerns by going forward with new port fees on Chinese ships that take effect Tuesday. China announced Friday that it would impose port fees on American ships in response. Associated Press writer Darlene Superville in Washington contributed to this report. A free press is a cornerstone of a healthy democracy. Support trusted journalism and civil dialogue. Donate now",https://www.pbs.org/newshour/world/china-refuses-to-give-in-to-trumps-tariff-threat,Politics,BBC,,https://d3i6fh83elv35t.cloudfront.net/static/2025/09/2024-11-06T075329Z_3403669_RC2JZAALTT9U_RTRMADP_3_USA-ELECTION-CHINA-REACTION-2-1024x683.jpg,2025-10-12T13:30:31-04:00,fdd0aacea56144adc7b0c0f068bcd5dfb890d434
