id_article,title,tags,content,url,category,source,author,image,published_date,content_hash
6eead56302a0,Brooks and Capehart on Trump’s focus on reaching the Gaza peace deal,"brooks and capehart, politics","Geoff Bennett: With President Trump celebrating victories abroad and targeting political enemies here at home, there is much to discuss tonight with Brooks and Capehart. That's New York Times columnist David Brooks and Jonathan Capehart of MSNBC. With a hello to you both. Jonathan Capehart: Hey, Geoff. Geoff Bennett: So both Israel and Hamas have agreed to phase one of the peace plan. We see the negotiations there on the screen. And that was followed by today celebrations in Israel and also along the Gaza Strip. I want to start with your reaction to this real breakthrough, Jonathan. Jonathan Capehart: Look, I'm going to say something that I have never said before and that this audience has never heard me say before. Kudos to the president. I think we are at this point because the president was single — he was focused, single-mindedly focused, on getting something, getting a deal done, getting the hostages out. The hard part comes after he leaves the region, after we get past phase one, assuming we get the 20 — that the Israeli hostages released, the 20 who are presumed alive, after the 2,000 Palestinians are released by Israel. Once we get past that, there are so many questions that are still out there that leaves me skeptical that my kudos to the president will maintain. One, will they be able to get Hamas disarmed? Two, will there be a legitimate negotiating partner among the Palestinians for Israel and everyone to negotiate with, an international stabilization force for the area? And also the big thing, sort of Palestinian self-governance, or, in other words, a two-state solution, something that Prime Minister Netanyahu has made clear he's not interested in. And if we're going to get through all these phases of this peace plan, the single-minded focus of the president that got us to this crucial point will be needed for the next 19 phases. And I just don't see how he does that. Geoff Bennett: And given the history of dashed hopes in the region, what gives you hope that this agreement can endure? David Brooks: I got hope when Jonathan praised the president. (Laughter) David Brooks: So I have my fingers crossed he deserves the Nobel Prize. I thought you were going to go there. (Laughter) David Brooks: But it's impressive, what Trump has — did. First, he got together with the Saudis and the Qataris in New York during U.N. week and came up with this 20-point plan. And then he understood how to deal with Netanyahu. And I should say, in fairness, the Trump administration, both the first term and the second term, has been better on the Middle East than the Obama and Biden administration. There's something about that region he sort of gets. And so the way to deal with Biden — the way you deal with Netanyahu is, you show total support for Israel at the same time you're leaning on them. And so I think that the Biden people, when they were always withdrawing and threatening and saying, don't do that, that made Israel feel insecure. And they had to negotiate from a position of security and then they could bend. And so he got Bibi to go against his far right colleagues who wanted to basically annex the Gaza. And there is, like, now a separate Gaza territory, and that's an important achievement. The Qataris are an important role. Why is this little country in the center of all this? Partly because they are part of those Gulf states who wanted to make the Middle East a modern place. And so I think they play just tremendously a constructive role because they seem to talk to everybody. Will it work? I don't know, but there's no choice. There's no solution. Martin Indyk, who died about a year ago, had a piece in ""Foreign Affairs"" called the strange revival, I'm summarizing, of the two-state solution. Everybody wants to give up on the two-state solution. There is no alternative to the two-state solution. And so they're just going to have to stumble their way forward. Are they going to get there? Who knows? We have been covering the Middle East for a long time. They don't get there. But it looks a lot better than I thought it would look six months ago, a year ago, five years ago. Geoff Bennett: Yes. Well, shifting our focus to domestic politics, this past week, we saw former FBI Director James Comey arraigned, we saw New York Attorney General Letitia James indicted, both by the same Trump-appointed prosecutor. The former Trump National Security Adviser turned Trump critic John Bolton could be next, according to reports from MSNBC. And we talked about this last week, when the focus was solely on Comey, but President Trump's campaign of retribution is expanding. Jonathan Capehart: Yes, because this is what he told us he was going to do. The people he — the folks who have been indicted or expected to be indicted soon or on the list, people like Senator Adam Schiff of California, private citizen now Miles Taylor, the president made it clear that he wants something done and he wants his Justice Department to do it. He's on the record as saying they are guilty of something. Pam, go find it, Pam being the attorney general, Pam Bondi. So this is chilling because you now have a Justice Department that is supposed to, at least nominally, be separate and removed from the White House, taking orders from the president of the United States, who famously said, where's my Roy Cohn? Well, his Roy Cohn is named Pam Bondi. Geoff Bennett: David, there are supporters of the president who say that Letitia James ran on a campaign of going after Donald Trump and that this is simply accountability coming full circle, that this is justified reciprocity, to which you would say what? David Brooks: Well, that's how Donald Trump clearly thinks. He thinks they were politically motivated prosecutions. And I somewhat agree with him. I don't think Trump would have been brought up on those charges if he hadn't been Donald Trump. Nonetheless, what matters is the evidence. And Letitia James, she's accused of doing mortgage fraud that would have produced a benefit over the lifetime of the loan of $18,000. Now, you think about the numbers Donald Trump inflated his property values, they were not $18,000. They were times 100 million of that. And so the evidence against Comey is slight. The case against James is — it would have been — no one would have prosecuted. We know that because other prosecutors refused to do it. Jonathan Capehart: Right. David Brooks: And so this is clearly a revenge prosecution. Donald Trump makes it hard on us pundits, because he's so blatant, there's nothing interesting to say. (Laughter) Geoff Bennett: It is kind of all out there in the open. Jonathan Capehart: Right. It's out there. Geoff Bennett: Well, today marks the 10th day of the government shutdown, as we heard from the House Democratic leader. There has still been no substantive talks among the different parties. October 15, I have that day circled on my calendar because that's the day that if they're — if the government is still shut down, members of the military, if things stay the way they are, who have been deemed essential, they have been on the job, they will not get a paycheck. I mean, what do you make of all this at this point? Jonathan Capehart: You know why there aren't talks? Because the Republicans are not in town. The speaker of the House has kept the House out of session now for 20-some — 19 or 20 days and has already said that they're not coming back next week. You would think that the House speaker being on C-SPAN and taking that very emotional call on the Republican line, a woman saying — a military wife talking about the need for, like, the — not only health care, but for the check, for the paycheck, and saying, get — where are you guys? Get back to work. And he pivoted and blamed the Democrats. If they want to change the calculus of this conversation, they being Republicans, they should come back to town, because, if everyone's in town, then there's no excuse. Democrats will be in town in the House, will be in town next week. Why not come back to town and say, you want to talk, let's talk? Geoff Bennett: When even Marjorie Taylor Greene is calling out her own party and saying we need to fix for the Obamacare subsidies, what does that say about the internal dynamics within the GOP? David Brooks: Not much, I don't think. Marjorie Taylor Greene is out there and wherever she is. I think Republicans, like the Democrats, frankly, are pretty unified. And the weird thing about that is usually, when you cover a shutdown, somebody's feeling the heat. Nobody's feeling the heat yet. I don't think… Geoff Bennett: Yes, why is that? David Brooks: I think two things. One, the American people haven't yet felt it. Maybe, if you air travel, you will begin to feel it. When the military doesn't get paid, they feel it. But right now they're not feeling it. I was in Colorado this week, and, believe me, nobody was raising this with me. Nobody talked about it. That may change. Second, the American people have become so jaded and disgusted that they're just like, oh, whatever. And so if you look at the polling, at the beginning, it looked like they were more blaming Trump. But now, if you look at, do you approve of the way Democrats in House and Republicans in Congress, how are they handling it, it's like both get a 28 positive rating, so a low rating on both parties. But it's not really fueling the heat on either of these people. The second thing that I think there's — it's quite easy to cut a deal if the shutdown is really what Hakeem Jeffries said it was, which was about health care premiums. And it is partly about that. And Democrats, of course, are smart to talk that way because it's an issue that polls great for them. But I don't think it's only about that. For a lot of Democrats, it's also about Trump's authoritarianism. It's Trump's willingness to dishonor and disrespect Congress and not spend the money they have appropriated. And that's a much deeper issue that's much harder to resolve, because Donald Trump is not doing that. And then the Trump — the Republicans are also a little divided. Russell Vought did — the RIFs are starting today. There are a lot of congressional Republicans that don't like that. Geoff Bennett: Yes. David Brooks: And so there are these tensions within both parties. But, so far, they — their feet is not to the fire. But that may come in a couple weeks. Geoff Bennett: Well, as the shutdown drags on and more layoff notices keep landing, should Democrats hold the line? Jonathan Capehart: Yes. Yes, because I actually do think that they are pushing on health care because it's something that they care about. And, I mean, I take your point that the American people aren't feeling it writ large. But when you have a Republican calling on the Republican line on C-SPAN to chastise the Republican House speaker — the Republican House speaker, and you have got the poster child for MAGA, who is also saying, you know this premiums thing is an issue, to me, that says that the ground is shifting. And I also agree with David in this. While health care is the overarching, sort of popular issue because it's something that will affect the American people directly, rescissions has been my hobbyhorse, because why would and should Democrats trust any negotiation that they get into with Republicans and that is signed by the president if they know that, once — before the ink is dry, Russell Vought And the president will snatch back the money, snatch back the authority? Geoff Bennett: Jonathan Capehart, David Brooks, our thanks to you both. Jonathan Capehart: Thanks, Geoff. David Brooks: Thank you.",https://www.pbs.org/newshour/show/brooks-and-capehart-on-trumps-focus-on-reaching-the-gaza-peace-deal,Politics,BBC,,https://d3i6fh83elv35t.cloudfront.net/static/2025/10/brookscapehart-1-1024x526.jpg,2025-10-10T18:30:50-04:00,3195c7b38f19937795651b81055d9849f96657cc
7086a8421575,WATCH: Trump announces deal with AstraZeneca to lower drug prices for Medicaid,"astrazeneca, donald trump news, drug prices, medicaid, pharmaceutical industry, politics","WASHINGTON (AP) — AstraZeneca on Friday became the second major pharmaceutical manufacturer to announce it had agreed to lower the cost of prescription drugs for Medicaid under a deal struck with the Trump administration that avoided its threats of steep tariffs. Watch the announcement in the video player above. President Donald Trump made the announcement in the Oval Office with AstraZeneca CEO Pascal Soriot, who said that during tough negotiations to reach a deal, Trump and his team of officials had “really kept me up at night.” Under the agreement, AstraZeneca will charge most-favored-nation pricing to Medicaid, while guaranteeing such pricing on newly launched drugs, Trump said. That involves matching the lowest price offered in other developed nations. WATCH: Trump announces Pfizer deal to lower drug prices “For many years, Americans have paid the highest prices in the world for prescription drugs, by far,” Trump said, adding that the new deal may cut prices to “the lowest price anywhere in the world. That’s what we get.” AstraZeneca CEO Pascal Soriot shakes hands with President Donald Trump during an announcement about lowering U.S. drug prices, at the White House in Washington, D.C., Oct. 10, 2025. Photo by Kent Nishimura/Reuters AstraZeneca’s deal follows a similar agreement Pfizer announced late last month. Advocates have generally praised the administration’s efforts to cut drug prices, though some have expressed concerns that too much onus is being placed on the manufacturers to lower costs without implementing U.S. policy safeguards to ensure such outcomes. Both agreements, however, build on an executive order Trump signed in May that set a deadline for drugmakers to electively lower prices or face new limits on what the government will pay. Trump had suggested that a series of deals with drug companies would subsequently be coming. “The tariffs were a big reason he came here,” Trump said of Soriot. Cambridge, United Kingdom-based AstraZeneca makes a range of cancer treatments. Its products include the lung cancer drug Tagrisso; Lynparza, an oral treatment for ovarian cancer, and Calquence, which treats chronic lymphocytic leukemia. Those drugs brought in a total of more than $7.5 billion in U.S. sales last year. AstraZeneca announced Thursday that it would spend $4.5 billion on a new manufacturing plant near Charlottesville, Virginia, and its Republican governor, Glenn Youngkin, spoke during Friday’s Oval Office announcement to cheer groundbreaking on the new facility. The drugmaker said that project was the centerpiece of $50 billion in investments the company plans to make in the U.S. by 2030. AstraZeneca said it plans to reach $80 billion in total revenue by then, half of which will be generated in the United States. Trump predicted the investment’s could lead to 3,600 jobs domestically “just to begin with.” One of the AstraZeneca drugs was already subject to price reductions due to a Medicare negotiating strategy implemented under President Biden. Still, Trump insisted that Democrats shouldn’t “get credit” and suggested the party’s key leaders may try. The announcements came months after AstraZeneca said it was scrapping plans to expand a vaccine manufacturing plant in its home country. The company blamed several factors, including reduced government financial support. The Trump administration has put up a landing page for its new website, TrumpRX.gov, where people will be able to buy drugs directly from manufacturers, according to officials. Both Pfizer and AstraZeneca will offer medications through the site, according to the administration. The website’s landing page features two very large pictures of Trump and a promise that the site is “Coming Soon” in January 2026. It says at the bottom of the page that the site was “Designed in DC by The National Design Studio,” the new government website design hub that Trump created by executive order in August, which is being led by Airbnb co-founder Joe Gebbia. Associated Press writers Tom Murphy and Michelle L. Price contributed to this report. A free press is a cornerstone of a healthy democracy. Support trusted journalism and civil dialogue. Donate now",https://www.pbs.org/newshour/politics/watch-live-trump-expected-to-make-announcement-on-pharmaceutical-drug-prices,Politics,BBC,,https://d3i6fh83elv35t.cloudfront.net/static/2025/10/2025-10-10T220502Z_1009247009_RC2A9HAZNSHO_RTRMADP_3_USA-TRUMP-1024x683.jpg,2025-10-10T17:13:10-04:00,9f0915368983adc216815d4674628ca6dda2eaf3
6261c4327222,Wall Street tumbles in its worst day since April after Trump threatens more tariffs on China,"china, donald trump news, stock markets, tariffs, wall street, economy","NEW YORK (AP) — A monthslong calm on Wall Street shattered Friday, and U.S. stocks tumbled after President Donald Trump threatened to crank tariffs much higher on China. The S&P 500 sank 2.7% in its worst day since April. The Dow Jones Industrial Average dropped 878 points, or 1.9%, and the Nasdaq composite fell 3.6%. Stocks had been heading for a slight gain in the morning, until Trump took to his social media platform and said he’s considering “a massive increase of tariffs” on Chinese imports. He’s upset at restrictions China has placed on exports of its rare earths, which are materials that are critical for the manufacturing of everything from consumer electronics to jet engines. READ MORE: Trump threatens more tariffs after China restricts key exports “We have been contacted by other Countries who are extremely angry at this great Trade hostility, which came out of nowhere,” Trump wrote on Truth Social. He also said “now there seems to be no reason” to meet with China’s leader, Xi Jinping, after earlier agreeing to do so as part of an upcoming trip to South Korea. The ratchet higher in tensions between the world’s largest economies led to widespread drops across Wall Street, with roughly six out of every seven stocks within the S&P 500 falling. Nearly everything weakened, from Big Tech companies like Nvidia and Apple to stocks of smaller companies looking to get past uncertainty about tariffs and trade. The market may have been primed for a slide. U.S. stocks were already facing criticism that their prices had shot too high following the S&P 500’s nearly relentless 35% run from a low in April. The index, which dictates the movements for many 401(k) accounts, is still near its all-time high set earlier in the week. Critics say the market looks too expensive after prices rose much faster than corporate profits. Worries are particularly high about companies in the artificial-intelligence industry, where pessimists see echoes of the 2000 dot-com bubble that imploded. For stocks to look less expensive, either their prices need to fall, or companies’ profits need to rise. Levi Strauss dropped 12.6% for one of the market’s larger losses, even though it reported a stronger profit for the latest quarter than analysts expected. Its forecast for profit over the full year was also within range of Wall Street’s estimates, but the jeans and clothing company could simply be facing the challenge of heightened expectations after a big run. Its stock price came into the day with a surge of nearly 42% for the year so far. All told, the S&P 500 fell 182.60 points to 6,552.51. The Dow Jones Industrial Average dropped 878.82 to 45,479.60, and the Nasdaq composite sank 820.20 to 22,204.43. Some of Friday’s strongest action was in the oil market, where the price of a barrel of benchmark U.S. crude sank 4.2% to $58.90. It fell as a ceasefire between Israel and Hamas came into effect in Gaza. An end to the war could remove worries about disruptions to oil supplies, which had kept crude’s price higher than it otherwise would have been. Losses accelerated following Trump’s tariff threat, which could gum up global trade and lead the economy to burn less fuel. Brent crude, the international standard, dropped 3.8% to $62.73 per barrel. In the bond market, the yield on the 10-year Treasury sank to 4.05% from 4.14% late Thursday. It had already been lower before Trump made his threats, as a report from the University of Michigan suggested that sentiment among U.S. consumers remains in the doldrums. “Pocketbook issues like high prices and weakening job prospects remain at the forefront of consumers’ minds,” according to Joanne Hsu, director of the Surveys of Consumers. “At this time, consumers do not expect meaningful improvement in these factors.” The job market has slowed so much that the Federal Reserve cut its main interest rate last month for the first time this year. Fed officials have penciled in more cuts through next year to give the economy additional breathing room. But Chair Jerome Powell has also said they may change course if inflation stays high. That’s because lower interest rates can push inflation even higher. One potentially encouraging signal from the University of Michigan’s preliminary survey said consumers’ expectations for inflation in the coming year edged down to 4.6% from 4.7% the month before. While that’s still high, the direction of change could help the Fed and limit upward pressure on inflation. In stock markets abroad, indexes fell across much of Europe and Asia. Hong Kong’s Hang Seng fell 1.7%, and France’s CAC 40 dropped 1.5% for two of the bigger moves. But South Korea’s Kospi leaped 1.7% after trading reopened following a holiday. AP Writer Teresa Cerojano contributed. A free press is a cornerstone of a healthy democracy. Support trusted journalism and civil dialogue. Donate now",https://www.pbs.org/newshour/economy/wall-street-tumbles-in-its-worst-day-since-april-after-trump-threatens-more-tariffs-on-china,Politics,BBC,,https://d3i6fh83elv35t.cloudfront.net/static/2025/10/2025-10-09T144537Z_257358309_RC21XGAZEQNP_RTRMADP_3_USA-STOCKS-VALUATIONS-1024x683.jpg,2025-10-10T16:57:35-04:00,952a97b9aebf27ce4358601223b0db7398e1a8b5
