id_article,title,tags,content,url,category,source,author,image,published_date,content_hash
ad85897925e4,"My approach will pay off eventually, says Kemi Badenoch",,"My approach will pay off eventually, says Kemi Badenoch Kemi Badenoch: ""I was elected to do exactly what I am doing now"" Conservative leader Kemi Badenoch has said there may be a ""price to pay"" in the opinion polls but insisted her approach to changing her party would ""pay off eventually"". Speaking to the BBC's Sunday with Laura Kuenssberg, Badenoch argued that unlike Labour and Reform UK she wouldn't ""rush out"" new policies and would instead take ""time to get it right"". She acknowledged that the Conservative Party may take a ""small"" political hit for the strategy but said: ""Nothing good comes quickly."" As her party's conference kicks off in Manchester, Badenoch is facing questions about her first year as leader which has seen the party perform poorly in the polls and in local elections . The party has been losing support to Reform, and some former Conservatives MPs - and one current one - have defected to Nigel Farage's party. Asked if Reform had stolen the Conservatives' thunder, Badenoch said: ""Reform rushed out an announcement on indefinite leave to remain - they hadn't done the actual work. ""All of a sudden lots of Europeans with settled status didn't know what was going to happen to them. ""I make sure that when I announce something I think about how it is going to impact people. ""Winning elections without a plan is what got us into trouble, it is why Labour is floundering and that is what Reform will deliver. ""I said I want to do politics differently - doing it differently means being patient and taking our time to get it right."" Speaking to the same programme, Conservative Mayor of Tees Valley Lord Ben Houchen, said the party should have got ""our show on the road much sooner than we have"" and added that ""a space"" had been created for Reform to ""steal a march"". ""We need to start to pull our socks up... start to communicate better and start to outline what a positive Conservative Party can deliver for this country."" In the build-up to the conference, the Conservatives have released a string of policies including an intention to repeal the Climate Change Act, leave the European Convention on Human Rights and a plan to remove 750,000 illegal immigrants. Badenoch told Laura Kuenssberg there were ""too many people in our country who should not be here"". Asked where the people being deported would be sent to, Badenoch said: ""I'm tired of us asking all of these irrelevant questions about where should they go. ""They will go back to where they should do or another country, but they should not be here. ""We cannot have a situation where we cannot deport people, we don't know where they will go so they can stay here. ""That is basically inviting every single person across the world to our shores because we don't know where they would go after. That is a defeatist attitude and I will not have that."" In a later interview with GB News, Badenoch said that MPs who did not agree with leaving the ECHR would not be able to stand as a Conservative candidate. She said party members could have different views but added: ""If you want to be a Member of Parliament as a Conservative, then you need to understand that leaving the ECHR is a manifesto commitment.""",https://www.bbc.com/news/articles/c1l81766g2qo,politics,BBC,,https://ichef.bbci.co.uk/news/1024/branded_news/2510/live/e99ea350-a1d1-11f0-928c-71dbb8619e94.jpg,2025-10-05T10:07:37.609000+00:00,73ab04a6a56f1ef7da737d836d2f28803c05a16a
2e2fe331eaca,Police to get broader powers to restrict repeated protests,,"Police to get broader powers to restrict repeated protests Shabana Mahmood: ""This is not about a ban, it's about restrictions and conditions"" Police forces will be granted powers to put conditions on repeat protests, the government has announced, a day after nearly 500 protesters were arrested . Senior officers will be able to consider the ""cumulative impact"" of previous protests, the Home Office said, which could mean they instruct organisers to hold events elsewhere if a site has seen repeated demonstrations. Home Secretary Shabana Mahmood told the BBC's Sunday with Laura Kuenssberg programme the move was not a ban on protests but ""about restrictions and conditions"". Organisers of Saturday's protests, against Palestine Action being made a proscribed terror organisation, had been urged to postpone them after two men were killed in an attack at a synagogue in Manchester. Police forces had warned resources would be stretched, with officers across the country offering additional support to hundreds of synagogues and Jewish community sites. The new powers will be ""brought forward as soon as possible"", the Home Office said. Currently, for police to ban a march entirely, there needs to be a risk of serious public disorder. But under the new rules, where there have been repeated protests, police could impose conditions such as requiring it to be held elsewhere or on the duration of events. Mahmood said that while the right to protest is fundamental ""this freedom must be balanced with the freedom of their neighbours to live their lives without fear"". Large, repeated protests could leave sections of the country, particularly religious communities, ""feeling unsafe, intimidated and scared to leave their homes"", she added. This had been particularly evident within the Jewish community recently, she said. She told Laura Kuenssberg she was ""very worried about the state of community relations in our country"". ""I know I, as the home secretary, have a responsibility to think about the action the government can take to strengthen our communities, to make sure people are well-integrated into our society,"" she said. The home secretary will carry out a review of current protest legislation to ""ensure powers are sufficient and being applied consistently"", the government said. This will include powers to ban protests outright, the government said. Conservative leader Kemi Badenoch backed the new powers but questioned why it had taken so long and said the government must prove it had the backs of Jewish people. ""We believe in free speech but that has to be within the bounds of the law, if protests are used to intimidate, to incite hatred then that is not protest,"" she told Kuenssberg. Kemi Badenoch says the government 'must prove to Jewish people it has their back' Asked about the protests Mahmood said: ""I think just because you have a freedom doesn't mean to say you have to use it at every moment of every day, those people could have just waited a day or two and given people the chance to grieve and process what has happened."" Most of those arrested at protests on Saturday were held on suspicion of supporting the proscribed group Palestine Action. Organisers Defend Our Juries said around 1,000 took part in demonstrations around Trafalgar Square against the ban on the group and opposing Israel's actions in Gaza. Following the Home Office announcement on protests the group posted on social media accusing the government of ""silencing opposition"" and ""authoritarianism"". Hundreds of people have been arrested since the group was outlawed by former home secretary Yvette Cooper in the summer, predominantly for holding signs saying they support Palestine Action. Israel has repeatedly denied that its actions in Gaza amount to genocide and that its actions are justified as a means of self-defence following the 7 October 2023 Hamas attack. But last month the world's leading association of genocide scholars said that Israel's conduct meets the legal definition as laid out in the UN convention on genocide . The arrests have been criticized by human rights group Amnesty International, which said arresting people for ""peacefully sitting down and holding these signs"" was not a job for the police. Watch: Activists applauded their fellow protesters as they were detained Organisers of Saturday's protest, Defend Our Juries, had been asked to reconsider their plans following the killing of two men at the Heaton Park Hebrew Congregation synagogue on Yom Kippur - the holiest day in the Jewish religious calendar. But organisers said in a statement beforehand it hoped police ""choose to prioritise protecting the public from real terrorism, and not waste resources on enforcing the absurd and ridiculous ban on Palestine Action"". Adrian Daulby and Melvin Cravitz were killed after Jihad Al-Shamie drove a car into people outside synagogue in Manchester. Al-Shamie then tried to force his way into the building before being shot dead by armed police. Three others were injured in the attack. Several arrests have been made in relation to the attack and Mahmood said four people remained in custody on Sunday morning. The home secretary will write to chief constables on Sunday to encourage them to use all their powers to prevent and respond to public disorder, as well as thanking them for their response following Thursday's attack. Police forces are working with the Community Security Trust, a charity which works to protect Jewish people from terror and antisemitism, to reassure the Jewish community, the home office said. On Sunday, the Board of Deputies of British Jews is holding a commemorative event ahead of Tuesday's second anniversary of the 7 October attacks on southern Israel, in which about 1,200 people were killed and 251 others were taken hostage. The group has welcomed the government's move to increase police powers and described recent protests as ""deeply irresponsible and offensive"".",https://www.bbc.com/news/articles/c24rmdngrrjo,politics,BBC,,https://ichef.bbci.co.uk/news/1024/branded_news/c914/live/2fffa270-a1cf-11f0-928c-71dbb8619e94.jpg,2025-10-05T10:11:29.865000+00:00,df12e1a78af097241c429bffa847cfdf530123d5
e9f909e4722b,"Tories pledge to remove 750,000 migrants under borders plan",,"Tories pledge to remove 750,000 migrants under borders plan Paul Seddon Political reporter, Conservative Party Conference, Manchester Conservative leader Kemi Badenoch: ""They'll go back to where they came from"" The Conservatives say they would task officials with removing 750,000 illegal immigrants within five years, under Trump-style deportation plans. Under plans unveiled as its annual conference begins, the party has pledged to ban people who enter the UK without permission from ever claiming asylum. It would also prevent those whose claims are rejected from challenging decisions in the courts, with appeals instead handled by Home Office officials. Border officials would be instructed to remove people ""within hours or at most a few days"", the Tories say, with a reformed ""Removals Force"" unit seeing their funding doubled to £1.6bn per year. It comes as Tory activists gather in Manchester for their annual party conference, amid dire poll ratings under leader Kemi Badenoch and questions over how they can head off a potentially existential challenge from Nigel Farage's Reform UK. In the run-up to the four-day gathering, the party has already said it would end the UK's 75-year membership of the European Convention on Human Rights (ECHR) in a bid to thwart asylum appeals, confirming a widely-expected policy shift. Under the latest proposals, the Home Office's immigration enforcement unit would be rebranded as a ""Removals Force"" and given wider-ranging powers, along with an extra £820m per year the Tories say could be unlocked by closing asylum hotels. The party says it would give the new unit a ""mandate"" to remove at least 150,000 people each year, totalling 750,000 during the five-year lifetime of a Parliament. This would include people currently living in the UK illegally, the party says, as well as future illegal arrivals and all foreign nationals convicted of a crime more serious than minor parking or speeding offences. It would represent around a five-fold increase from the 35,000 migrants who were removed from the UK over the last year - the majority of whom went voluntarily. Visas threat The Tories say people would be deported to their home country if possible, or to ""safe"" third countries that would agree to take them. Like Reform, the party says it would negotiate returns agreements with other nations, and threaten to withhold aid spending and visas from countries that decline to co-operate. Speaking to the BBC's Sunday with Laura Kuenssberg programme, Badenoch said illegal migrants should ""go back to where they came from"". But pressed repeatedly to set out where people would go, she did not name particular countries, branding the question ""irrelevant"", adding that concerned voters were ""not interested in these sorts of questions"". 'No need for lawyers' The party says it wanted to take inspiration from the US, where President Trump has handed immigration enforcement officers sweeping new powers to arrest and deport undocumented migrants. The Tories say they would instruct police forces to check the details of everyone they arrest against biometric borders data, and would be allowed to use facial recognition without informing the public it is in use. It plans to expand an unspecified ""existing facility"" to detain migrants before they are removed, with a capacity for between 1,000 and 2,000 people. The party also plans to restrict the grounds for claiming asylum to those facing a threat from the government in their home country, excluding claims from those fleeing conflict or ""less tolerant"" laws on religion or sexuality. Key to their proposals is a plan to abolish the Immigration Tribunal, which hears challenges to failed asylum claims, handing the appeals process instead to a team of officials within the Home Office. The Tories also plan to abolish taxpayer-funded legal aid in immigration cases, with a document on the proposals arguing there ""will be no need for lawyers"" because claims would be ""fairly assessed against the criteria"". ECHR divide The Conservatives' plan comes after Reform UK made similar pledges over the summer to take the UK out of the ECHR and deport 600,000 migrants within five years if it won power. Badenoch sought to portray her party's plans as more credible, adding that it was backed by ""comprehensive legal analysis"" in the form of a review by Tory peer and former justice minister Lord Wolfson of Tredegar. ""Reform have nothing but announcements that fall apart on arrival,"" she added. The Tory move to leave the ECHR creates a key dividing line with the Labour government, which has opted against leaving the treaty but is reviewing how it is applied in UK law. Labour has also pledged tougher action to deal with small boat crossings over the English Channel, which are set to break record numbers this year. Labour recently set out plans to lengthen refugees' route to permanent settlement in the UK in a bid to make the country less appealing to migrants, and has negotiated a ""one in, one out"" pilot scheme with France. Unlike Reform, the Tories are not promising to formally disapply the Refugee Convention, a 1951 treaty that prevents signatory countries from returning refugees to countries where they face serious threats to their life or freedom. But the party says it would legislate to prevent courts having regard to it in asylum cases, with a pledge to leave if ""activist judges attempt to override Parliament"".",https://www.bbc.com/news/articles/c708g5x2yqzo,politics,BBC,,https://ichef.bbci.co.uk/news/1024/branded_news/51dc/live/637c5ed0-a1d0-11f0-928c-71dbb8619e94.jpg,2025-10-05T09:50:00.189000+00:00,f91cf706e5c8f293267f61775811521b2928ef09
e796b8833e23,"UK will leave ECHR if Tories win election, Badenoch says",,"The Conservatives will take the UK out of the European Convention on Human Rights (ECHR) if they win the next election, Kemi Badenoch has announced. The announcement comes after a review by the Conservative party's lead lawyer found staying in the ECHR blocks migration reform and leads to the persecution of military veterans. Last year Badenoch said leaving the treaty would not be a ""silver bullet"" for tackling immigration, but on Friday argued the move was necessary to ""protect our borders, our veterans, and our citizens"". Labour said the Conservative leader had adopted ""a policy she argued against"" because she is ""too weak to stand up to her own party in the face of Reform"". The announcement on the eve of the party's conference in Manchester will settle the party's position following months of internal divisions. The ECHR had become a focal point in the Conservative Party's immigration debate, with senior figures arguing that its provisions have obstructed efforts to deport foreign criminals and failed asylum seekers. Announcing plans to leave marks a sharp shift in Conservative policy and will likely become a central theme of the party's election campaign. It comes amid growing pressure from Reform UK, which has already pledged to leave the ECHR. Badenoch said: ""I have not come to this decision lightly, but it is clear that it is necessary to protect our borders, our veterans, and our citizens. ""I have always been clear that we should leave the ECHR, if necessary, but unlike other parties we have done the serious work to develop a plan to do so – backed by legal advice from a distinguished King's Counsel."" The announcement comes after detailed legal review led by shadow attorney general Lord Wolfson of Tredegar concluded that the ECHR placed ""significant constraints"" on the government. The review, set up by Badenoch in June, tested how international law impacted five key Conservative policy proposals: deporting foreign criminals and illegal immigrants, protecting military veterans from legal action, prioritising British citizens in access to public services, ensuring prison sentences reflect parliamentary intent, and preventing courts using climate change laws to block planning reforms. “In all the five policy areas, the ECHR places significant constraints,"" Lord Wolfson found. This week, Prime Minister Sir Keir Starmer said the government would look again at how international laws including the ECHR were interpreted by UK courts - to stop unsuccessful asylum seekers blocking their deportation on the grounds they could be sent to worse prisons or healthcare systems. Sir Keir told the BBC he did not want to ""tear down"" human rights laws, but said mass migration in recent years meant there needed to be a change. Legal experts have warned leaving the ECHR would carry serious political and legal consequences. Catherine Barnard, University of Cambridge professor of EU Law, has noted withdrawal would isolate the UK alongside Russia and risk breaching both the Good Friday Agreement and the UK-EU trade deal. But Lord Wolfson's nearly 200 page legal advice reportedly found that alternative domestic attempts to soften the impact of the ECHR rules would be ineffective. He also said withdrawal would not breach the Belfast (Good Friday) Agreement or the Windsor Framework. A Labour Party spokesperson said the decision had been ""forced on"" Badenoch, and not been ""thought through"". ""Badenoch now thinks she is both incapable of negotiating changes to the ECHR with our international partners, and a sufficiently accomplished diplomatic operator to renegotiate the Good Friday Agreement."" Conservative shadow Home Secretary Chris Philp said the ECHR had ""enabled foreign criminals and illegal immigrants to stay in the UK"", adding: ""Protecting our borders is non-negotiable."" During previous debates on immigration, moderate conservatives have expressed concern about leaving the ECHR. In 2023, ex-deputy prime minister Damian Green said leaving the ECHR was a ""red line"" for the One Nation Tories group he chaired. More recently, Boris Johnson's justice secretary Sir Robert Buckland said leaving the ECHR would be an act of folly - calling instead for reform from within. Both Green and Sir Robert lost their seats in the 2024 election and no longer sit in Parliament. A Reform UK spokesman said ""nobody trusts a single word"" the Conservatives said. ""The Conservatives had 14 years in government to leave the ECHR. Since then, it's taken them 14 months to even decide what their policy is,"" the spokesman said. ""The Conservative Party is finished."" The Liberal Democrats seized on Tory splits, telling ""former One Nation Conservatives who have been abandoned by their party's lurch to the extremes: you have a home with us"", Lib Dem leader Sir Ed Davey said by leaving the ECHR ""Kemi Badenoch has chosen to back Nigel Farage and join Vladimir Putin"". ""This will do nothing to stop the boats or fix our broken immigration system – problems caused by the last Conservative Government that Badenoch still hasn't apologised for,"" he added.",https://www.bbc.com/news/articles/c1mxy2j2elro,politics,BBC,,https://ichef.bbci.co.uk/news/1024/branded_news/299f/live/f343b7e0-a098-11f0-a918-e111dd54869c.jpg,2025-10-04T11:04:17.343000+00:00,07cfd5216d41317f402b98fc9c2dd27eaebf4642
