id_article,title,tags,content,url,category,source,author,image,published_date,content_hash
6e335b79c2d1,Ghost of Yōtei: PlayStation puts blockbusters back on the menu,,"Ghost of Yōtei: PlayStation puts blockbusters back on the menu Tom Richardson BBC Newsbeat Sucker Punch Ghost of Yōtei follows the story of Atsu, a warrior on a quest for revenge PlayStation fans and PlayStation haters don't usually agree. But there's one complaint (or insult, depending on who you ask) that's been coming from both sides. ""Where are all the games?"" Big-budget, single-player blockbusters from in-house studios have been the key to Sony's console success. In the PlayStation 4 days fans got a steady stream of cinematic adventures, but that's felt more like a trickle since 2023's Spider-Man 2. However, Sony's newest release - Ghost of Yōtei - is a return to its proven triple-A format. BBC Newsbeat spoke to Nate Fox, a creative director at Sony-owned studio Sucker Punch, about the wait for the game and some of the reasons behind it. Firstly, what took so long? Sucker Punch's latest is a follow-up to 2020's feudal Japan-set adventure Ghost of Tsushima, one of the last big PS4-exclusive releases from Sony. ""Games do take a long time to make, so it's no small chunk of your life,"" says Nate. Ghost of Yōtei relocates the action a few hundred miles north, to the Honshū region, and the setting a few hundred years later, to 1603. This time the story follows Atsu, a female warrior on a quest to exact revenge against the Yōtei Six - a group of warlords responsible for her family's murder. With a previous game to build on, it's not a completely fresh start but, Nate explains, the project is still a huge undertaking. Just having a new main character, for example, requires input from writers, animators and character designers, to name just a few of the roles involved. Behind the scenes there are many, many more. Sucker Punch Ghost of Yōtei provides a larger open-world environment for players to explore Although Sucker Punch has roughly 200 employees at its base near Seattle, many hundreds more work on its games. The credits for Ghost of Tsushima, for example, contained about 1,800 names. Some of those will be from abroad, or from outside companies that specialise in certain technical fields. ""Making a video game requires all sorts of different skills, from incredibly technical people... to people who are very driven by emotions, like our writing staff,"" says Nate. ""And these teams work in co-ordination. It's like conducting an orchestra. ""You need to have all of the elements coming together."" Nate says that a dizzying number of elements can go into a single scene - from music to the programming that makes leaves blow across the screen at a pivotal moment. ""All these teams have to have a sense of where they're going,"" says Nate. A sense of direction is something fans have accused PlayStation of lacking in the last few years. Under its previous boss, Jim Ryan, the division launched development on 12 online multiplayer titles, known as ""live-service"" games in the industry. Some of the most famous examples, such as Fortnite, Roblox and Call of Duty, keep players engaged for months and generate huge amounts of money. Sony has had success in the space with last year's Helldivers II, but a disastrous failure with Concord , which was taken offline just two weeks after its release. It has since cancelled multiplayer projects based on some of its most popular series, including God of War and The Last of Us. Pursuing the multiplayer market is a strategy Sony has admitted is not entirely ""going smoothly"", but it's said some titles with online elements, such as Gran Turismo and baseball game MLB: The Show, have performed well. The stars of its most recent promotional showcase were Saros, a follow-up to 2021's Returnal, and the long-awaited Wolverine game from Spider-Man maker Insomniac - both single-player games. Marvel/Insomniac Wolverine is one of two big single-player exclusives due to hit PlayStation in 2026 High-profile releases can be magnets for controversy, as Sucker Punch recently found when a developer's joke about the death of right-wing American activist Charlie Kirk prompted a backlash. The studio eventually fired the employee involved, and founder Brian Fleming told journalist Stephen Totilo that ""celebrating or making light of someone's murder is a deal-breaker for us"", when asked about it. Some right-wing video game influencers have also attacked Ghost of Yōtei for featuring a female protagonist. Nate says it was an ""unconventional choice"", but key to the story the developers wanted to tell of an underdog defying society's expectations. As the game progresses, Atsu's reputation as an Onryō - a vengeful spirit found in Japanese folklore - grows. ""People think there's no way this woman could have taken out members of the Yōtei Six unless she is a supernatural creature,"" says Nate. Big releases can also invite another kind of scrutiny - hype. With the gap between new games widening, it puts pressure on developers to deliver something that will impress fans. How do you cope? ""Certainly there's a lot of expectation that games will be beautiful and emotionally compelling,"" says Nate. ""And that pressure definitely gets us going, but it's nothing compared to the pressure we put on ourselves."" Listen to Newsbeat live at 12:45 and 17:45 weekdays - or listen back here .",https://www.bbc.com/news/articles/c2lxy1w121lo,entertainment,BBC,,https://ichef.bbci.co.uk/news/1024/branded_news/b984/live/9657ead0-9fb0-11f0-b741-177e3e2c2fc7.png,2025-10-03T09:28:20.748000+00:00,f459d34801744162e24ac67260c6a3756c432f69
747a93a3276c,Only Fools and Horses actor dies aged 68,,"Only Fools and Horses actor dies aged 68 Getty Images Patrick Murray also featured in Quadrophenia and The Bill Only Fools And Horses star Patrick Murray has died at the age of 68. Murray played Mickey Pearce, a friend to Sir David Jason's Del Boy and Nicholas Lyndhurst's Rodney Trotter, across 20 episodes between 1983 and 2003 on the BBC comedy series. He also had roles in 1979 films Quadrophenia and Scum, 1990s TV sitcom The Upper Hand, as well as The Bill, ITV Playhouse and Bergerac. Only Fools And Horses co-star Sue Holderness, who played Marlene in the sitcom, paid tribute to Murray on X, saying: ""R.I.P. darling Patrick. Much love. You will be greatly missed."" Getty Images Murray (right) featured in 20 episodes of Only Fools and Horses Murray revealed he was diagnosed with cancer in July 2021 and had an operation to remove a lung tumour in its early stages, followed by chemotherapy, in January 2022. Subsequent scans found another tumour in his liver that was unconnected to his lung cancer and also treatable. In a health update in May 2022, Murray said his oncologist told him his ""lung cancer was cured and that the tumour in my liver was shrinking"", however by April 2023 he revealed his lung cancer had returned. A BBC spokesperson said: ""We are very sad to hear of the passing of Patrick Murray, much loved for his role as Mickey in Only Fools And Horses, our thoughts are with his friends and family."" The BBC understands Murray, who lived in Kent, died in Rochester. Additional reporting from PA Media.",https://www.bbc.com/news/articles/cly18vlj7gjo,entertainment,BBC,,https://ichef.bbci.co.uk/news/1024/branded_news/05f5/live/08796390-9fb7-11f0-8410-854cfa733f11.jpg,2025-10-02T18:02:23.906000+00:00,12991e7348308a11ca604f3c21f7cfa3e0de6e7d
b9002fe665e3,"Ban on local paper lifted, say Reform council lawyers",,"Ban on local paper lifted, say Reform council lawyers Jude Winter East Midlands and Anna Whittaker Nottingham political reporter BBC The council said it would now send press releases to the Nottingham Post Reform UK-led Nottinghamshire County Council appears to have lifted a ban on a local newspaper. County council leader Mick Barton banned the Nottingham Post and its online arm, Nottinghamshire Live, from speaking to him and other councillors ""with immediate effect"" on 28 August. Law firm CMS LLP served the council with a legal letter on Tuesday on behalf of Reach, the organisation that runs the publisher, calling for the ban to be withdrawn in full. The county council's team manager for litigation, Geoff Russell, responded to the letter on Thursday and said it would now provide the Post with press releases and invite them to council events. However, the Post said it remained ""unclear"" whether Barton would now speak to them, but added they were ""committed to building a working relationship going forward"". Barton has been approached for comment. Council leader Mick Barton has said his door is ""always open"" to the local newspaper, despite refusing to speak to its reporters According to the Post, the ban was prompted by an article about local government reorganisation , written by its agenda editor Oliver Pridmore. The authority also stopped sending press releases to the publication and inviting them to council events. But Barton later clarified the ban only applied to the issuing of press releases and to him personally . Barton later lifted the ban for the three BBC-funded Local Democracy Reporting Service journalists who work out of the publication. The Post believed the ban was in breach of local government regulations, Article 10 of the European Convention on Human Rights - in relation to freedom of expression - and the council's own councillor code of conduct. ""I'm pleased this unprecedented ban has been lifted and the situation finally resolved, so that we can continue to get on with our jobs as we always have done,"" said senior editor Natalie Fahy. ""That means asking questions of elected council officials, having access to publicly-funded information and events and holding them to account on behalf of our communities in Nottinghamshire.""",https://www.bbc.com/news/articles/cy8rdyne0yyo,entertainment,BBC,,https://ichef.bbci.co.uk/news/1024/branded_news/3b9e/live/78122b10-9fbc-11f0-928c-71dbb8619e94.jpg,2025-10-03T13:51:22.183000+00:00,334ec33465a2b972d2573643abd0d718a0c12696
a8a72d988387,Peaky Blinders to return to TV with gang's new era,,"Peaky Blinders is to return to TV to follow the exploits of a new generation of the Shelby family after World War Two. The sixth series, which was broadcast in 2022, was billed at the time as the ""the end of an epic story"", although producers did say the story would ""continue in another form"". A forthcoming Peaky Blinders film, set at the start of the war, will see Cillian Murphy reprise his role as gang leader Tommy Shelby. That will now be followed by two new TV seasons, which ""will be rooted in Birmingham and will tell the story of a city rising from the ashes of the Birmingham blitz"", creator Steven Knight said. ""The new generation of Shelbys have taken the wheel and it will be a hell of a ride."" The show will pick up in 1953, when ""the race to own Birmingham's massive reconstruction project becomes a brutal contest of mythical dimension"", the BBC said. ""This is a city of unprecedented opportunity and danger: with the Shelby family right at its blood-soaked heart."" The show will be screened on the BBC in the UK and on Netflix around the world. Murphy will be among the executive procucers, although the BBC declined to say whether any characters from the previous era would return on screen. Peaky Blinders started in 2013, and has so far followed the street gang through the 1920s and 30s. It won best drama at the TV Bafta Awards in 2018. The story will jump to the 40s for the film, titled The Immortal Man, which will star Murphy alongside Oscar nominee Barry Keoghan, Adolescence actor Stephen Graham and Dune's Rebecca Ferguson.",https://www.bbc.com/news/articles/ce84kdyxj87o,entertainment,BBC,,https://ichef.bbci.co.uk/news/1024/branded_news/3d5f/live/ff970fd0-9f9c-11f0-8e4d-7723b0da5e04.jpg,2025-10-02T14:58:48.541000+00:00,f3314abc4e21e804e1b76760b85b32e77ce7493f
003b51f624dc,Nirvana baby loses legal case over Nevermind album,,"The man who was photographed as a baby on the cover of Nirvana's classic album Nevermind has failed in his attempts to sue the band for distributing child pornography. A four-month-old Spencer Elden was pictured swimming naked underwater on the 1991 LP's famous cover. He sued the rock band and photographer Kirk Weddle, but a judge has ruled that ""neither the pose, focal point, setting, nor overall context suggest the album cover features sexually explicit conduct"". A lawyer for Nirvana said: ""We are delighted the court has ended this meritless case and freed our creative clients of the stigma of false allegations."" Mr Elden originally filed a lawsuit in 2021, arguing that his identity and name were ""forever tied to the commercial sexual exploitation he experienced as a minor which has been distributed and sold worldwide"". US District Judge Fernando Olguin dismissed it in 2022 because Mr Elden submitted it after the 10-year limit for filing a civil case. An appeals court overturned that decision, allowing Mr Elden to refile the case. However, Judge Olguin has now ruled that, beyond the fact Mr Elden was naked, nothing came ""close to bringing the image within the ambit of the child pornography statute"". He likened the image to a family photo of a child bathing, and said it is ""plainly insufficient to support a finding"" of child pornography. ""Nudity must be coupled with other circumstances that make the visual depiction lascivious or sexually provocative,"" Judge Olguin wrote, quoting from an earlier ruling. The judge also cited factors including the presence of Mr Elden's parents at the photo shoot, the fact the photographer was a friend, and the fact he had previously ""embraced and financially benefitted from being featured on the album cover"". Mr Elden's legal team told Rolling Stone they ""respectfully disagree"" with the decision and plan to appeal. ""As long as the entertainment industry prioritizes profits over childhood privacy, consent, and dignity, we will continue our pursuit for awareness and accountability,"" said James R Marsh of the Marsh Law Firm.",https://www.bbc.com/news/articles/cq8eplxd7yzo,entertainment,BBC,,https://ichef.bbci.co.uk/news/1024/branded_news/938f/live/d201acf0-9f84-11f0-92db-77261a15b9d2.jpg,2025-10-02T10:35:23.624000+00:00,a85ddbb05b98f61a4bb405268379adcf44a9d178
ac397e120c20,"Les Misérables lyricist felt lack of credit, archive reveals",,"Les Misérables lyricist felt lack of credit, archive reveals Helen Bushby Culture reporter Getty Images Herbert Kretzmer died in 2020 and his archive has been donated to Cambridge University The late Herbert Kretzmer, who wrote the English libretto for Les Misérables, felt he was not given enough credit for transforming the original French musical into the hugely popular English-language version, letters have revealed. They were found in the archive of Kretzmer, who died in 2020 aged 95 , after it was donated to Cambridge University Library . A letter that Kretzmer wrote to theatre producer Cameron Mackintosh in 1987 referenced ""unpleasant actions taken by others to downgrade my credit and contribution"". ""I think it will clarify matters if I spell out, for the first and I hope only time, the straight and verifiable facts about the authorship of the English version of Les Miserables,"" he wrote. Getty Images The enduringly popular show has been performed around the world over the past 40 years ""Not many people have had the opportunity to compare my English version, page for page, with the original Paris libretto. ""So let me, as briefly as I can, point out the evidence for declaring that, in terms of the actual lyrics now being sung nightly in New York and London, there is very little indeed that can be called translation. ""Les Miserables in English is virtually a new, rewritten show."" He described it as ""a mass of material that is so totally reconceived and rewritten that there is no longer any substantial similarity between my lyrics and the 1980 Paris model"". ""I regret that this letter has to be written at all, but in view of the unpleasant actions taken by others to downgrade my credit and contribution, I must emphasise that Les Miserables is not a show translated or re-written, but a show reborn,"" he said. The Times quoted Mackintosh as saying in reference to the correspondence in the archive: ""Herbie has a very strong moral compass as a person. He has the very quality to reflect in popular song and lyric the ethos of Victor Hugo."" Les Misérables was adapted from Hugo's 1862 novel for a French album in 1980 and a stage show the following year. The English-language version of the musical opened in London in 1985. The archive also includes a 1985 memo about auditions, which reveals Brian Blessed was among those discussed for roles in the original cast, stating he ""has been working hard on his voice, and has made considerable improvements"". It also says Fiddler On The Roof actor Chaim Topol and Exorcist actor Max von Sydow ""will, hopefully, be available to come to London... to discuss the roles of Jean Valjean and Javert"". The archive also features letters from huge names including actors Frank Sinatra and Peter Sellers, and photographs taken by director Stanley Kubrick, along with Kretzmer's cuttings from his newspaper work and his theatre career. The South African-born English writer also penned the lyrics to the 1960 song Goodness Gracious Me, made famous by Sellers and Sophia Loren. He also worked with French singer Charles Aznavour on his 1974 hit She. Word changes discovered Dr Liz Savage, special collections assistant at Cambridge University Library, helped to catalogue the Les Misérables sections of the archive. She found many edits in Kretzmer's second draft of the musical, including changing ""common"" to ""angry"" in the song Do You Hear The People Sing? The song, which has been sung in protests around the world, begins: "" Do you hear the people sing?/ Singing the song of angry men. "" The archive also reveals how Kretzmer tried out various other words first, including ""valiant"" and ""fearless"", before deciding on ""angry"". Documents also show that the song Stars was in danger of being cut, before pressure from Kretzmer and others to keep it, writing: ""We must altogether disassociate ourselves from the decision to cut Stars. We do not agree that the show is weakened by the inclusion of this song."" Kretzmer's widow, Sybil, said: ""The prestige of Cambridge University reflects the impact and influence of Herbert's work, and we know the archive will be preserved by the Library and live on for generations to come, just like Les Miserables itself.""",https://www.bbc.com/news/articles/cx2518579w9o,entertainment,BBC,,https://ichef.bbci.co.uk/news/1024/branded_news/dd01/live/26656f90-9f74-11f0-9ccd-4dc2d8fa5ad2.jpg,2025-10-02T11:01:51.484000+00:00,68d79192aa4613c1606d5135a3210a9bd0d683a0
c98536685f22,Sam Fender among Mercury Prize performers,,"Sam Fender among Mercury Prize performers Gemma Sherlock North East and Cumbria BBC Sam Fender will perform live after his album of the year nomination Artist Sam Fender will be one of the performers at this year's Mercury Prize ceremony after being shortlisted. It is the first time the prestigious music industry awards, which are taking place at the Newcastle's Utilita Arena on 16 October, will be held outside of London . The 2025 edition will be hosted by BBC Radio 6 Music's Lauren Laverne, from Sunderland, and be broadcast by the BBC. Fender, from North Shields, is one of 12 artists shortlisted for the best British or Irish album of the past year, including Emma-Jean Thackray, FKA twigs, Jacob Alon, Joe Webb, Martin Carthy, Pa Salieu, Pulp, and Wolf Alice, for the live performances. Each artist will perform one track from their album. Leader of Newcastle City Council, Karen Kilgour, said the success of the MOBO Awards showed ""what Newcastle was capable of"". ""We can't wait for the national and international music spotlight to shine on our fantastic city, showcasing our burgeoning music industry, hugely talented musicians and amazing venues,"" she said. Sunderland's Lauren Laverne will host the Mercury Prize ceremony A week of events - the Mercury Prize Newcastle Fringe by music agency Generator - will also begin in the city on 9 October. This will include workshops, industry events and performances from local artists and a choir of eight to 12 year olds across seven local authority areas. North East Mayor Kim McGuinness said: ""We've seen Sam Fender rise from our own music community and I want to make sure he's just one of many incredible local talents that succeed."" London North Eastern Railway (LNER) will be providing a special named service for the event, transporting judges and guests to the arena. Newcastle department store Fenwick will also reveal bespoke windows showcasing the 12 Albums of the Year on 13 October and host two events as part of the Mercury Prize Fringe. Tom Jackson Pulp are also among this year's performers The Mercury Prize shortlist and winner is decided by a panel of industry experts. Unlike the Brit Awards, which recognise commercial success, the Mercury Prize seeks to reward artistic achievement. Primal Scream were the first winners in 1992, with the accolade going to Leeds band English Teacher last year. PJ Harvey in 2001 and 2011, remains the only multiple winner. The 2025 Mercury Prize 12 albums of the year are: CMAT  - EURO-COUNTRY Emma-Jean Thackray - Weirdo FKA twigs - EUSEXUA Fontaines D.C. - Romance Jacob Alon - In Limerence Joe Webb - Hamstrings & Hurricanes Martin Carthy - Transform Me Then Into A Fish Pa Salieu - Afrikan Alien PinkPantheress - Fancy That Pulp - More Sam Fender - People Watching Wolf Alice - The Clearing",https://www.bbc.com/news/articles/cy042ee48w8o,entertainment,BBC,,https://ichef.bbci.co.uk/news/1024/branded_news/0976/live/91db5cd0-9f83-11f0-b37a-e1e2cb3893d3.jpg,2025-10-02T11:38:39.721000+00:00,46feebbf60402ca87446337f00ad232e2a2420c1
8ec9ad5fe99a,Irish singer CMAT postpones UK tour due to wisdom teeth pain,,"Irish singer CMAT has announced she will postpone her sold-out UK tour scheduled to begin today. In a social media post, the 29-year-old rising star said she requires urgent dental surgery to remove two wisdom teeth. ""I currently can't even open my mouth wide enough to laugh let alone sing,"" she told her followers. Ticket holders will be offered a rescheduled concert date or a refund. CMAT, whose real name is Ciara Mary-Alice Thompson, was due to play in London on Thursday on her Euro-Country tour, following the release of her third album in August. She was scheduled to perform in Manchester, Leeds, Newcastle, and Glasgow over the coming week. Thompson confirmed she would cancel her upcoming concerts after learning she had an infected wisdom tooth. ""I realise that this will cause difficulties for so many of you who may have made plans to travel to these dates,"" CMAT wrote on Instagram . ""And for this I can only say I am so so sorry."" A dentist informed her she required surgery to remove both lower wisdom teeth next week, for which she'll need to spend at least two weeks recovering. The Irish singer said she cannot ""chew any food"" and ""can barely think straight"" due to the pain. Rescheduled dates for the October leg of CMAT's tour will be announced ""as soon as possible"", the singer said. Her UK tour is due to wrap up in March before she performs in Europe and at the 2026 Coachella festival. She performed at Glastonbury earlier this year, where she spoke to the BBC about her experience of online fat-shaming after a festival performance the year before. Euro Country, the title track from the singer's new album touches on the impacts of the 2008 financial crisis in Ireland. BBC Radio 1 was pushed to clarify it did not edit out the Irish language intro to the single in its first broadcast of the song in July after 45 seconds of the song were not played on air. The station said it had played the version provided to them by CMAT's label, AWAL.",https://www.bbc.com/news/articles/c20v22j3ve3o,entertainment,BBC,,https://ichef.bbci.co.uk/news/1024/branded_news/3cf4/live/24267cb0-9f1f-11f0-928c-71dbb8619e94.jpg,2025-10-02T02:09:59.605000+00:00,e70bf843d42cd36e21fb7e6f9fb77d66a65e5dac
