id_article,title,tags,content,url,category,source,author,image,published_date,content_hash
934a2d1f5a6e,Call for Miliband to go as second oil refinery loses jobs,,"Oil workers have called for Energy Secretary Ed Miliband to be sacked as a second UK oil refinery moves towards closure. The 125 job losses at the East Lindsey site were announced on the morning of Prime Minister Sir Keir Starmer's speech to the Labour Party conference. But Unite's Sharon Graham, head of the union which represents workers at the refinery, warned Sir Keir needed to rescue the government's industrial strategy with fresh investment to protect jobs. Urging him to ""wake up and smell the coffee"", Ms Graham said there could be no growth agenda when the country's industries were shedding jobs. Jamie Dalgetty, Unite branch chairman at the site, said workers had lost faith in Miliband and his junior energy minister, Michael Shanks. ""As part of the National Oil Refinery and Terminal Convenience Committee, I can speak for all of us that we're calling for Ed Miliband and Michael Shanks' removal from their position,"" he said. He added that Miliband needed to support takeover bids for the site, in a similar government intervention to the one taken at the Scunthorpe steel works, also in north Lincolnshire. Ms Graham called on the prime minister to intervene and get the industrial strategy and the Net Zero strategy back on track, because ""it is a disaster"" that two oil refineries are facing closure in less than a year ""under Labour's watch"". ""They've got to have a plan for British industry, you cannot just do this piecemeal,"" she said, comparing Germany's £1 trillion plan for energy diversification to the UK's £50bn. ""It doesn't make any sense for a growth plan if you're allowing oil refineries to shut down and other parts of British industry to shut down,"" she said. ""We need to have the money, like Germany's just done, they've changed their fiscal rules, we need to have the money to invest in these jobs."" The Unite general secretary criticised what she said was a net zero plan for jobs rather than carbon, adding that Chancellor Rachel Reeves should change course by growing the UK economy through investment in jobs. She called on Reeves to pay down the UK's debt to GDP ratio by loosening the fiscal rules and funding industrial renewal in her November budget. ""They need to borrow money for our industry,"" she said. ""It's not as though that money disappears. ""Let's grow Britain by investing in jobs, that's what they need to do.""",https://www.bbc.com/news/articles/c62zl95kk70o,politics,BBC,,https://ichef.bbci.co.uk/news/1024/branded_news/2838/live/1bec68d0-9df2-11f0-8540-6fc8d6a2c819.png,2025-09-30T12:37:07.428000+00:00,9735eb9aedc795926a891bef98ce569a8b4842b7
2ae140198d13,The battle is on for the Conservatives to show they matter,,"The battle is on for the Conservatives to show they matter Laura Kuenssberg Presenter, Sunday with Laura Kuenssberg BBC ""Oh God,"" and then a pause, a sigh, and then, ""Oh God,"" again. Just as a senior Conservative was telling me the party might be able to climb out the terrible hole it's in, news popped up of another of its ranks deserting for Reform UK. Their response? Sad resignation, at yet another resignation. The individual exit of Sarah Atherton, who was briefly a defence minister when the Tories were in power, is not the point. Well over a dozen Conservative MPs or former MPs have made that same move. The question for the Conservatives perhaps this weekend is: is there a point? You don't need me to tell you that the Conservatives are unpopular - deeply so. The hangover from the last election was always going to be nasty after a proper thumping, 14 years in power, and, oh yes, those five prime ministers. But the party's standing has fallen even further since then. No discernible bounce with its new leadership under Kemi Badenoch. No profit from the misery of the government. For the group once regarded as the most successful political operation in the western world, it's dire. Technically, the Tories are still the main opposition. That brings status and meaning. It's Badenoch who gets to ask six questions of the prime minister every week. It's the Conservatives who, as is traditional, are most often called on to respond to government announcements. They still have way more MPs than the Liberal Democrats, or the SNP, and legions more than Reform or the Greens. But politically, it just doesn't feel at this moment that they are the government's hungry main challengers. That's in part because they were smashed to bits in July 2024 and it was always going to take a bit of time to come round. It's in part because the party is so far behind in the polls. It's in part because the government is very deliberately making its arguments against Reform, not their traditional Conservative rivals. As another senior party figure observes, Labour's ""framing of cutting the Tories out is the right one"". It suits Labour and the Lib Dems to treat the Tories as if they are irrelevant. And it's in part, many Conservatives argue, because Badenoch ""just hasn't generated any traction, any attention"" during her time in charge. As the Conservatives arrive in Manchester for their conference, in the very serious aftermath of the attack on Heaton Park synagogue, the primary job is to grab any attention: perhaps the Tory party is smack bang in the middle of a battle to matter at all. Reuters Prime Minister and Labour leader Sir Keir Starmer Like it or not, just as Sir Keir Starmer has discovered, grumpy parties who are not doing well point the finger at their leader. Badenoch has admirers in the Conservative Party for speaking out on particular issues like single-sex spaces, free speech, or declaring that some cultures are in her view ""less valid"" than others. Some of her colleagues applaud her blunt, tell-it-like-it-is manner. But politics is also a business of charm and empathy. A senior Tory told me after the election defeat the party had to ""go everywhere and do a mea culpa, to listen and take a kicking"". But the issue with Badenoch, they say, is ""she is grand... hasn't been anywhere and isn't listening to anyone"". Ouch. With conference about to start, it's almost a Tory tradition to fill the papers and podcasts with gripes about the party leader. She has had some more effective performances at Prime Minister's Questions. Policies are starting to emerge. Money has kept flowing to the party.  One of her backers maintains that although she is still ""finding her way"", she has some of the same ""strength and character as a young Margaret Thatcher"". Thatcher was seen as ""strange and shrill"" when she got the job, but became the party's most successful boss of modern times. But as Badenoch approaches a year in the job, it's becoming harder to find people who'll make that comparison. Whatever Badenoch's personal strengths and failures, there is a different criticism of how she has gone about the job, with a party veteran suggesting, ""there is just no pace, no nimbleness"". Maybe that should have been staring the party in the face: her original pitch for the job was ""Renewal 2030"" - a date past the next general election. During many of her interviews Badenoch has said she wants to take her time working out the right moves for the party, developing credible ideas rather than being rushed. You can expect lots of policy to be unveiled in the next few days. But politics moves incredibly fast, and another source agrees pace is a problem, saying: ""What she misunderstood is you get one chance to introduce yourself to the public – she lost the chance to generate any traction and she won't get that back."" Reform UK leader Nigel Farage was only too happy to step into that ""vacuum"", gaining strength in the polls and grabbing headlines while the Tories were busy making other plans. Getty Images Badenoch after delivering a speech at the Institute of Chartered Accountants' Hall in September Candidly, it is not unusual to hear Conservatives saying freely in private that Badenoch won't be in the job for long, she could be ""out by Christmas"", or ""might not even have to be dragged out"" if the party bombs at the polls in a set of mega elections in May. Indeed, when asked the question herself in a conference warm-up interview, she more or less said: Well, ask me then. Refreshingly honest from a leader who isn't fully in control of her own destiny? Or foolhardy when this is a moment when she ought to be mustering as much authority as she can? The conference gives a shop window to the party and its leader to show what she is made of too. As one senior MP says: ""This conference is about her, and making it clear she has a direction and a sense of where she is going, and it is hers and she is going to lead it – we have this one chance."" ""We understand the polls aren't great, a source close to the party leadership adds. ""There needs to be a bit of understanding from those who are grumbling."" But where is Badenoch trying to lead? ""If I want a can of full fat coke, then I go and buy one, if I like what Reform are saying I'm gonna vote Reform, I'm not going to vote for a party that's not quite there,"" a party insider says. Badenoch's signals on climate change, on leaving the European Convention on Human Rights, tip towards the right of the Conservative spectrum, on territory that right now, Reform have painted in bold primary colours. Bloomberg via Getty Images Reform leader Nigel Farage has grabbed headlines while the Tories were busy making other plans Badenoch is a Brexiteer, a strong advocate of free speech, and seemingly often up for a spat in the latest round of culture wars. But politics is a business - not quite like any other - but a business nonetheless. And many in the party reckon she is going after the wrong customers and ought to be trying to appeal more to soft liberals or soft Tories, rather than to those interested in Reform. ""Frankly, the gap in the market is on the centre right,"" one source says. Some of the current Tory top brass are keen to get the argument onto issues they hope might appeal more to more voters, and it's not stupid to guess it, yes, the economy. One shadow minister says: ""We have to talk about the money in your pocket and trying to articulate what all of Labour's tax rises and debt means to you in terms of the cash in your pocket and the food in your fridge."" With Reform UK in the ascendant, are they the right enemy for the Tories in any case, one source wonders? Their presence on the right means the Conservatives right now don't have the luxury of assuming they will always be the number two. The party used to be ""free to carry on in opposition in our own space – now when the party looks for who its enemy is, is it Labour, Reform or Lib Dems, or it doesn't know?"". According to one source close to the party leadership, in recent years people have struggled to know what the party stands for: ""We have flip-flopped, criss-crossed, gone from [Theresa] May to [Boris] Johnson, to [Rishi] Sunak."" There will be big announcements over the next few days setting out Badenoch's position ""and it will be the job of MPs and councils and everyone to go and sell that message"". Getty Images Badenoch giving a speech earlier this year As party members and associated hangers-on start to arrive in Manchester today, there are reasons to be gloomy for the current leadership. If you look back at the polling, Badenoch is in a worse position according to net satisfaction ratings than John Major, William Hague, Iain Duncan Smith, David Cameron, Theresa May,  Boris Johnson and Rishi Sunak. (If you're wondering, I didn't forget Liz Truss, but she wasn't around long enough to have her popularity measured after nearly a year). ""I don't remember it ever being this bad,"" says one insider, suggesting not just that Badenoch's time will be up before too long, but also that the party has been hollowed out of experience and knowledge, and many of the big-name MPs who have stuck around have, frankly, rather checked out. But one of Badenoch's backers suggests it's the party, not the leadership, that ought to have a word with itself. They told me their colleagues have got a ""messiah complex - ever since Margaret they think there is a leader out there who will lead them to the promised land"". In other words, get your heads down, get your work done, and stop thinking it's all about the person at the top. ""We need to understand real history, not folk history,"" they say, suggesting a new leader would not and could not solve the party's problems on their own. Do it again, and a frontbencher suggests ""people will think, 'Oh God, they haven't changed!'"" But the overall picture for the Tories' top team is as foul as the weather in Manchester which awaits them. ""They're not relevant, they don't matter - that is the big thing the current team have not understood,"" one Tory source worries. ""If it's not resolved soon it's easy to see  how we might be in third or even fourth place"" when it gets to the next election, they add. Not for the first time, you don't need me to remind you - but I will - that politics in the 2020s is a very unpredictable era. There are known unknowns. Might Badenoch pull off a blinding speech this week? Will Labour be patient with Sir Keir until the general election? Will Reform hold together? Will the economy improve? And unknown unknowns that we can't list right now. And anyone who claims to know what's next may as well be trying to sell ice to an Eskimo. The Conservative party has been pronounced more or less gone before. There was even a book published titled ""The Strange Death of Tory England"". Five years later, David Cameron strolled into No 10. But the party is in trouble. Conferences are always an opportunity for political parties, but also a risk. The pressure is on the Tories to show they matter in the next few days, or more on their own side may wonder what they're for. BBC InDepth is the home on the website and app for the best analysis, with fresh perspectives that challenge assumptions and deep reporting on the biggest issues of the day. And we showcase thought-provoking content from across BBC Sounds and iPlayer too. You can send us your feedback on the InDepth section by clicking on the button below.",https://www.bbc.com/news/articles/c864dzn827xo,politics,BBC,,https://ichef.bbci.co.uk/news/1024/branded_news/d3fb/live/caa9fb50-a02f-11f0-928c-71dbb8619e94.jpg,2025-10-04T12:23:06.987000+00:00,dff044017b39fe87f8c8af7769116c6e2ad6c693
e7bc4c86a145,Meet the Caerphilly by-election candidates,,"Meet the Caerphilly by-election candidates Getty Images Caerphilly Castle is the second largest in Britain, behind only Windsor Castle Eight politicians are competing in, arguably, the most interesting by-election in the 26-years of Welsh devolution. They are seeking to represent the constituency of Caerphilly in the Welsh Parliament. Prompted by the sudden death of Labour Senedd member Hefin David in August , the poll takes place on 23 October. Here you can read about all of the candidates, in alphabetical order, and their messages to voters. The details were provided by the political parties and candidates, and reflect their views. Steve Aicheler - Welsh Liberal Democrats Welsh Liberal Democrats Who is he? Steve Aicheler lives in Machen with his family and is a community councillor and school governor. He works for a national non-profit organisation promoting entrepreneurship in education and has founded several local businesses. Steve says he is standing to give Caerphilly a strong, independent voice in the Senedd who puts people first. What are his policies? Fix the social care crisis to free up the Welsh NHS and reduce waiting times. Provide 30 hours of free childcare a week for every child aged nine months to four years, so that every parent in Caerphilly has access to affordable and flexible childcare. Prioritise education, ensuring young people in Wales have equal access to opportunity as young people in England. Bring jobs back to Caerphilly, challenging a Cardiff-centric City Deal that has failed to deliver for local people. Protect local services that are under threat from Labour locally and in the Senedd. Anthony Cook - Gwlad Glenn Whitehouse Who is he? Anthony Cook grew up in Cefn Hengoed, lives in Ystrad Mynach and says his family has been ""part of the Rhymney Valley mining history for generations"". He is a father of three children that he takes on ""adventures over Parc Penallta and Gelligaer Common"" and says that, as a boy, he ""played in the shadow of Penallta colliery and caught the C9 bus to Bargoed to go shopping with my nan in a once thriving high street"". He says he understands the ""struggles that have followed the decline of our traditional industries"". The name of his party, Gwlad, means country in Welsh. What are his policies? Help town centres by building homes, siting public services such as polyclinics (centres for GP surgeries, outpatients and minor injuries) there and encouraging evening shop opening, at least from April to October. Reform VAT; as new build is free of the tax but repair is not, making it cheaper to build new on the outskirts of town rather than restore the old centre. The elected Welsh government should run Wales, not boards and panels of the ""great and the good"" which require additional funding to administer and give ministers a way to evade responsibility. End subsidies for renewable energy schemes such as solar farms that are destroying good agricultural land. Oppose Welsh government funding of politically partisan NGOs (non-governmental organisations), eg those that campaign for men to access women's spaces. Gareth Hughes - Green Party Who is he? Gareth Hughes, who lives in Caerphilly, was born in Bangor and educated at Friars Grammar School, Coleg Harlech and the London School of Economics. He has been an apprentice printer, print journalist, university lecturer, researcher and played a prominent role in the early days of housing associations in Wales. He returned to journalism, with the creation of the National Assembly for Wales in the late 1990s, as an ITV Wales political reporter and commentator, later analysing public life for BBC Radio Wales, Radio Cymru and others. What are his policies? Create green jobs for people where they live. Provide better public services - including more evening bus services and warm, safe housing. Build stronger communities with empowered local voices. Promote a fairer, greener future tackling the climate emergency. Gareth Potter - Welsh Conservatives Welsh Conservatives Who is he? Gareth Potter is married with two children and has lived in Ebbw Vale since last year. Born in Pontypool, he grew up on a Trevethin council estate and attended West Monmouth Comprehensive School. He worked for retailers, including Matalan, then in charity retail with the British Heart Foundation before focusing on politics full-time. He was previously a staff member for Conservative South Wales East Senedd member Natasha Asghar and worked, for the last four years, as a campaign manager for Bristol and South Gloucestershire Conservatives. What are his policies? Scrap business rates for small businesses to allow our forgotten high streets to grow, creating more local jobs and reducing unemployment across Caerphilly and growing tourism. Ban mobile phones in schools by rolling out lockable phone pouches across all schools in Caerphilly and ensure children are automatically excluded for carrying knives into school. Push to extend GP services beyond 09:00 BST to 19:00 and review NHS hospital planning which has seen hospitals like Ysbyty Ystrad Fawr designed for A&E services but instead all A&E going to the Grange in Torfaen 30mins away for residents living just yards from Ystrad Fawr. Scrap Wales' 20mph default speed limit and build an M4 relief road south of Newport to support growth in our town and villages across Caerphilly. Keep local services open while cutting council waste, scrapping the Senedd expansion while initiating an Anti-Waste Action Plan. Llŷr Powell - Reform UK Reform UK Who is he? Llŷr Powell has lived and worked in Caerphilly for the last five years and has called the area home for much of his professional life, aside from a brief hiatus to work in the House of Commons in 2024. He has worked in communications in public, political and charitable organisations, including roles in political communications and public affairs, where he has used his platform to highlight issues facing the left-behind communities of south Wales. He is a fluent Welsh speaker, and describes himself as an enthusiastic supporter of grassroots Welsh rugby and a keen follower of the national side. What are his policies? Protect the NHS, free at the point of delivery, with free prescriptions. Champion shorter waiting lists, more frontline staff, proper funding and an upgrade for Ysbyty Ystrad Fawr. Support local high streets, be a strong voice for Caerphilly's local economy and prioritise attracting much-needed investment to create more opportunities and jobs in this area. End the Nation of Sanctuary policy, which has wasted £55m of taxpayers' money. Fight to keep libraries open as the Labour council wants to close 10 of them while sitting on almost £190m in reserves as council tax keeps rising. Ensure reserves are spent on local communities not wasteful projects. Get Wales moving again by pushing to reverse Labour's 20mph speed limits, which are negatively impacting Caerphilly's economy and putting businesses off investing in the region. Back better and safer transport links. Roger Quilliam - UKIP Who is he? Roger Quilliam has been a member of UKIP's National Executive Committee since 2024. The party says he has worked for over two years closely with party leader Nick Tenconi in activism and citizen journalism for UKIP, Turning Point UK, and Disciples of Christ. UKIP says he campaigns against mass immigration, communism, liberalism, and in favour of patriotism, nationalism, and traditionalism and that his core values are rooted in family, community, national identity, justice, and law and order. What are his policies? Abolish the Senedd. Freeze immigration for a minimum of five years. Mass deportations and remigration. Reinstate Christianity back into the heart of government and put Britons first. Richard Tunnicliffe - Welsh Labour Welsh Labour Who is he? Richard Tunnicliffe has lived in Caerphilly with his Troedyrhiw-born wife Lynda for 26 years and they raised their three sons in the town. He has worked as an accountant and financial analyst and runs a publishing company with his wife, specialising in Welsh translations of popular children's books. He was encouraged to become more active in the local party by Hefin David, who was mentoring him to be a candidate in next year's Senedd election at the time of his death. What are his policies? Honour Hefin David's legacy by listening to constituents and solving community problems together. Champion Bevan's NHS by working proactively with local health service leaders. Earn trust by doing what I say I will do and never over-promising. Calling for the council to prioritise protecting libraries across the borough and use any future funding to do so. Lindsay Whittle - Plaid Cymru Plaid Cymru Who is he? Lindsay Whittle was born in Caerphilly town, he lives in Abertridwr, was raised on the Penyrheol council estate and attended Cwm Ifor Primary School. A councillor for Penyrheol since 1976, he was Caerphilly council leader from 1999 to 2004 and 2008 to 2011, and has been Plaid Cymru group leader on the council since 2022. From 2011 to 2016 he was a South Wales East assembly membe r (as Senedd members were previously known). What are his policies? Campaign for a fair funding settlement for Wales to help protect local services and oppose cuts, recently opposing plans to close public libraries and a leisure centre across the Caerphilly constituency. Attract quality jobs through Plaid Cymru's Making Wales Work plan, giving locally-owned small and medium-sized businesses and co-operatives in Caerphilly more help and adjusting business rates to boost town centres. Billions spent on rail projects in England, such as HS2 and the Oxford-Cambridge line, bring extra money to Scotland and Northern Ireland but not Wales. Releasing cash for Wales would help pay for local improvements. Invest in primary healthcare: Lindsay Whittle supports Plaid Cymru's plan to set up elective care hubs to get people seen faster, with a triage system to speed up referrals between GPs and hospitals. BBC Wales is holding a live debate for the candidates of the Caerphilly by-election on 15 October. Click below to apply to be in the audience.",https://www.bbc.com/news/articles/c0m481298wpo,politics,BBC,,https://ichef.bbci.co.uk/news/1024/branded_news/e993/live/22503d30-9fbb-11f0-b73e-e715acbd6a10.jpg,2025-10-03T05:11:38.442000+00:00,5846c7c7332e7da6a412a0e69cb201c1177899ef
